title,price,offer,category,site
"onikuma K8 RGB Gaming Headset  7.1 Surround Sound Noise Canceling Mic ,PC , PS4-3 , Mobile And Xbox",799,N/A,controllers-and-joysticks,noon
Apedra Usb Wired Gaming Mouse 7Button Macro Definition Optical Computer Mouse,189,38% Off,controllers-and-joysticks,noon
Point POINT USB GAMING KEYBOARD PT-950,300,33% Off,controllers-and-joysticks,noon
AULA F2058 Wind Rainbow Full Gaming Mechanical Keyboard - Blue Switches Black,899,10% Off,controllers-and-joysticks,noon
PXN 180 Degree Universal Usb Car Racing Game Wired Steering Wheel,"3,700",N/A,controllers-and-joysticks,noon
"DOBE Universal Controller Charging Station for PS5 / Xbox Series S & X/Switch Pro, Dual Type-C Controller Charger Dock with LED Indicator, Charging Dock for Two Controllers",150,74% Off,controllers-and-joysticks,noon
DOBE Silicone Case For PS4 Controller,149,N/A,controllers-and-joysticks,noon
FANTECH Venom Ii Wgc2 Vibe Edition Wireless 2.4Ghz Gaming Mouse With Rechargeable Battery,"1,049",N/A,controllers-and-joysticks,noon
"MARVO Gaming Mouse USB - 7 LED Colours, Adjustable up to 8000 DPI, Ergonomic Design, Gaming Grade Optical Sensor with 7 Programmable Buttons, Black  - M292-BK",390,N/A,controllers-and-joysticks,noon
"REDRAGON Redragon M606 Nothosaur Gaming Mouse with Optical Sensor 3200 DPI, 6 Buttons (Black)",605,42% Off,controllers-and-joysticks,noon
JINDUN G100F USB RGB Gaming Headset - 7.1 Surround Sound - adjustable leather head bridge - In-line Control,499,44% Off,controllers-and-joysticks,noon
Google Google 30W USB C Charger,349,46% Off,controllers-and-joysticks,noon
"REDRAGON GM212 Gaming streaming microphone designed for gamers, RGB","1,599",10% Off,controllers-and-joysticks,noon
"REDRAGON M711 Cobra Chroma 12,400 Dpi, 7 Programmable Buttons Gaming Mouse",875,7% Off,controllers-and-joysticks,noon
Langsdom G7 Gaming Headset USB 7.1 Surround Sound -RGB Colorful light - Flexible Swivel Noise Reduction Mic - 40mm Drivers - For PC & PS4 | Black,475,17% Off,controllers-and-joysticks,noon
FlyDigi 2-Piece Wasp Feelers Sweat-Proof Finger Sleeves,95,N/A,controllers-and-joysticks,noon
2B 2B  5in1 Racing wheel For PS3/PS4/PC/XBOX ONE/Switch GP026,"3,799",16% Off,controllers-and-joysticks,noon
DOBE Silicone Case For PS5 Controller - Blue,149,N/A,controllers-and-joysticks,noon
cardoo CardoO VR Box Pro – Wired VR Headset with Lightning Cable | Immersive VR Glasses with 360° Panoramic View | Built-in Wired Headphones,"1,499",25% Off,controllers-and-joysticks,noon
"FANTECH Large Gaming Mouse Pad Mushroom Phase Moon Phase Desk Mat, Boho Flowers and Leaves Computer Big Mouse Pad Washable Cloth Non-Slip Rubber Base Keyboard Pad Mouse Mat for Office with Stitched Edges  ( 70cm x 30cm x 2 mm )",149,61% Off,controllers-and-joysticks,noon
"RAZER DeathAdder Essential Gaming Mouse with 6,400 DPI Optical Sensor - Black","1,599",46% Off,controllers-and-joysticks,noon
Generic Sweat-Resistant Pubg Fingers Suitable For Long Play,18.95,5% Off,controllers-and-joysticks,noon
HP X-55 Ergonomic Optical Wired Gaming Mouse With 3 Buttons,79,68% Off,controllers-and-joysticks,noon
REDRAGON :Redragon H848 Bluetooth Wireless Gaming Headset - Lightweight - 7.1 Surround Sound -- Detachable Microphone - for Multi Platforms,"2,365",21% Off,controllers-and-joysticks,noon
Apedra Usb Wired Gaming Mouse 7Button Macro Definition Optical Computer Mouse - Black,179,N/A,controllers-and-joysticks,noon
"REDRAGON K662 Gwern Dual Mode Wireless, Bluetooth Gaming Mechanical Keyboard, Red Switch","1,699",32% Off,controllers-and-joysticks,noon
SUP 400 In 1 Handheld Console Sup,549,N/A,controllers-and-joysticks,noon
havit F2069 RGB Light 10 Clock Mode Cooling Pad Cool For Laptop Low Noise Fan Cooler With Cell Phone Holder,815,43% Off,controllers-and-joysticks,noon
Techno Zone K39 USB Gaming Headset RGB 7.1 Virtual Surround Sound - Dual 50mm Drivers  - DEEP BASS - Noise Reduction mic - In Body Control  For PC | Silver,899,25% Off,controllers-and-joysticks,noon
Gamma joystick controller for pc 2 pcs,399,N/A,controllers-and-joysticks,noon
REDRAGON C211 Gaia Gaming Chair – Black/Red,"8,599",14% Off,controllers-and-joysticks,noon
Forev Gaming Mouse Wireless Colorful Glare Mouse FV-W505 - Black Red,495,N/A,controllers-and-joysticks,noon
"RAZER Kraken X Lite Ultralight Gaming Headset- for PC, Xbox, PS4, Nintendo Switch - Classic Black","2,299",14% Off,controllers-and-joysticks,noon
"AULA Wired Gaming Mouse , S50 (RGB) 2400 DPI , High end optical engine , ergonomic design , feel comfortable - black",275,21% Off,controllers-and-joysticks,noon
REDRAGON Ranger M910-KS Gaming Mouse Long Range Charging Wireless,"1,295",23% Off,controllers-and-joysticks,noon
REDRAGON G815 PLUTO Wireless Gamepad Controller,"2,220",38% Off,controllers-and-joysticks,noon
Sony Dualsense Edge Wireless Controller (Playstation 5) - White/Black,"13,333",8% Off,controllers-and-joysticks,noon
"KontrolFreek KontrolFreek Fps Freek Vortex for PlayStation 4 (PS4) Controller | Performance Thumbsticks | 1 High-Rise Convex, 1 Mid-Rise Concave | Orange",250,16% Off,controllers-and-joysticks,noon
REDRAGON Redragon K565R RUDRA Gaming Mechanical Keyboard - RED Switch- Rainbow LED Lighting - English & Arabic Keys - Black,"1,589",N/A,controllers-and-joysticks,noon
"GameSir K1 Kaleid Wired Controller for Xbox Series X|S, Xbox One,Windows 10/11 & Steam, Plug and Play Gaming Gamepad, Transparent Video Game Controller with Hall Effect Joysticks/Hall Trigger","3,030",8% Off,controllers-and-joysticks,noon
Altec Lansing ALGH9603 Gaming Headset - Mesh Earcups - Noise Cancelling Microphone - Inline Volume Control - Breaded Cable,499,16% Off,controllers-and-joysticks,noon
"Beexcellent GM500 Mesh earcups Gaming Headset, 7.1 Surround Sound PS4 Headset with Microphone, For Games (Camo)",499,44% Off,controllers-and-joysticks,noon
"REDRAGON GS520 PRO Anvil RGB Desktop Speakers, 2.0 Channel PC Computer Stereo Speaker with 6 Colorful LED Modes","3,050",32% Off,controllers-and-joysticks,noon
"JERTECH Jertech DK500 USB Mini Silent Keyboard , Wired Office Comfort keyboard - 78 Slim Round keycap - Arabic & English | Black",275,21% Off,controllers-and-joysticks,noon
DOBE Dobe Dual USB Type C Fast Charging Dock PS5 Controller Charger Station with LED Indicator - (White) - TP5-0515B,450,N/A,controllers-and-joysticks,noon
REDRAGON Redragon H270 Mento RGB Gaming Headset,"1,275",N/A,controllers-and-joysticks,noon
ZIDLI ZIDLI M80 Gaming Mouse  – Ergonomics  6 buttons- 7 RGB colors Backlight – 8800 DPI  – 3 million click life time – Weigh : 69g | Black,285,43% Off,controllers-and-joysticks,noon
Gigamax Double Vibration Game Pad GP8032 With four control buttons as well as four shoulder buttons for assigning specific actions in your games,335,32% Off,controllers-and-joysticks,noon
A PLUS KOSMOS Control Gaming Mouse Pad - Size 1000 X 400 X 3 MM - Anti-slip - Anti-fray,195,56% Off,controllers-and-joysticks,noon
AULA Aula F2058 Full Mechanical Gaming Keyboard With Rainbow Backlit LED - Blue Switches |Arabic/English,999,N/A,controllers-and-joysticks,noon
REDRAGON Redragon K568 Rainbow Avenger Mechanical Gaming -Blue Switch,"1,110",52% Off,controllers-and-joysticks,noon
Lenovo Thinkplus G80-B USB RGB Gaming Headset - 7.1 Surround Sound - Noise Cancelling Microphone,549,8% Off,controllers-and-joysticks,noon
Sony PS5 DualSense Controller Charging Dock Station PlayStation in Hand Fast,"1,225",56% Off,controllers-and-joysticks,noon
"REDRAGON GS560 ADIEMUS - RGB ,  2.0 Channel USB Wired Soundbar ,Compact Size, Excellent Sound - Black","1,499",11% Off,controllers-and-joysticks,noon
GMS RGB Colorful LED Light Soft Large Gaming Mouse Pad,250,35% Off,controllers-and-joysticks,noon
"Genius HS-M200C On Ear Office Headset Lightweight With Mic Noise-cancelling Microphone For Office, Call Center",125,58% Off,controllers-and-joysticks,noon
FANTECH GP12 Revolver Gaming Controller - Dual Vibration - Ergonomic grip for long-term gaming - Familiar Console-Like Layout,699,50% Off,controllers-and-joysticks,noon
onikuma K19 Gaming Wired Headset With Microphone For PS4/PS5/XOne/XSeries/NSwitch/PC,800,N/A,controllers-and-joysticks,noon
DOBE Silicone Protective Kit For PS5 Controller-Green,260,13% Off,controllers-and-joysticks,noon
PXN 5-In-1 Racing Wheel For Xbox One/Xbox Series X/S/PC/PS3/PS4/Nintendo Switch,"3,100",26% Off,controllers-and-joysticks,noon
"REDRAGON Redragon H350 Pandora Rgb Wired Gaming Headset, Dynamic Rgb Backlight - Stereo Surround-Sound - 50 Mm Drivers - Detachable Microphone, Over-Ear Headphones Works For Pc/Ps4/Xbox One/Ns-Black","1,780",N/A,controllers-and-joysticks,noon
MARVO M112 USB Wired Gaming Programmable Mouse Multi DPI Speed and LED Lights,299,33% Off,controllers-and-joysticks,noon
Memo CX07 Magnetic Phone Cooler 15W,950,13% Off,controllers-and-joysticks,noon
Grand Gaming Mouse Colorful Lightning With 7 Button And Nylon Braided Wire Elegant Appearance Efficient Gaming Mouse 3200 Dpi For Laptop & For Computer - Black Silver,500,N/A,controllers-and-joysticks,noon
Sony DualSense Wireless PS5 Controller (Official Version) - Purple,"4,250",35% Off,controllers-and-joysticks,noon
Sony PlayStation 5 DualSense Wireless Controller,"4,049",19% Off,controllers-and-joysticks,noon
Sony Playstation UAE 10 USD Gift Card,699,22% Off,controllers-and-joysticks,noon
Cougar Cougaregy laptop sleeve 15.6'' case for laptop,120,N/A,controllers-and-joysticks,noon
"AULA Aula-H508 Gaming RGB Mouse With Side Wings, 4800 Dpi, Usb, Ergonomic,with multiple custom accessories ,support macro programing , 6 gear adjustable DPi  Backlit For Laptop And Desktop (WHITE OR BLACK)",599,40% Off,controllers-and-joysticks,noon
DOBE Dual Charging Dock With USB Cable For PlayStation 4 Wireless Controller,400,16% Off,controllers-and-joysticks,noon
Generic Finger Sleeves 1 Pair For PUBG Mobile Games Contact - Black/red,23,48% Off,controllers-and-joysticks,noon
REDRAGON Gaming Mouse M710 Memeanlion Chroma With 7 RGB Backlight Modes,"1,032",31% Off,controllers-and-joysticks,noon
Sony DualShock 4 Wireless Controller For PS4,950,N/A,controllers-and-joysticks,noon
Sony DualSense Wireless Controller For PlayStation 5 - Cosmic Red,"4,249",N/A,controllers-and-joysticks,noon
Forev HEADFONE FOREV GAMING FV-G97-5x1,599,32% Off,controllers-and-joysticks,noon
DOBE Silicone Case For PS5 Controller,208,N/A,controllers-and-joysticks,noon
Logitech Driving Force G29 Gaming Racing Wheel + Driving Force Shifter,"20,999",19% Off,controllers-and-joysticks,noon
Zero Wireless Game Controller For PlayStation 3 Black,360,N/A,controllers-and-joysticks,noon
Microsoft Xbox Elite Wireless Controller Series 2,"10,579",N/A,controllers-and-joysticks,noon
Lava Lava ST-125 Laptop Cooling Pad with 2 USB Ports and Fan Control Button for 353x253x30.5mm - Black,393,25% Off,controllers-and-joysticks,noon
Sony Dualshock Wireless Controller For PlayStation 4,"3,600",10% Off,controllers-and-joysticks,noon
Steam Steam Cards 50$,"3,450",N/A,controllers-and-joysticks,noon
"Hunterspider V4 Gaming Headset for Xbox One, PS4, PC, Controller, Noise Cancelling Over Ear Headphones with Mic, LED Light Bass Surround Soft Memory Earmuffs for PS2 Mac",520,N/A,controllers-and-joysticks,noon
KIWI design KIWI design 16FT Link Cable USB 3.0 A to C Cable,"1,479",N/A,controllers-and-joysticks,noon
ERXUNG J1 High Quality LED Light Gaming Surrounding Headset With Noise Cancelation Microphone USB+3.55mm Jack For PC & Playstation - Black Blue,399,16% Off,controllers-and-joysticks,noon
"GAMDIAS P1B 3 IN 1 COMBO - RGB Gaming Keyboard, Blue Switch - RGB Mouse with Optical Sensor 3,200 DPI - Mouse Pad 24 X 18 CM",845,32% Off,controllers-and-joysticks,noon
Apple iTunes Gift Card Voucher 100 USD Multicolour,"6,800",N/A,controllers-and-joysticks,noon
"Maono PD400X Dynamic Microphone, USB/XLR Podcast PC Microphone with Software, EQ,Tap-to-Mute, Headphone Jack, Gain Knob & Volume Control, Studio Mic for Broadcast, Recording, Streaming & Gaming","4,999",23% Off,controllers-and-joysticks,noon
"REDRAGON GS520 Anvil RGB Desktop Speakers, 2.0","1,180",N/A,controllers-and-joysticks,noon
Sony DualSense Wireless PS5 Controller - Grey Camouflage,"4,400",N/A,controllers-and-joysticks,noon
TESORO Laser Gaming Mouse Grey,194,N/A,controllers-and-joysticks,noon
"HYPERX Hyperx Solocast – Usb Condenser Gaming Microphone, For Pc, Ps4, Ps5 And Mac, Tap-To-Mute Sensor, Cardioid Polar Pattern, Great For Gaming, Streaming, Podcasts, Twitch, Youtube, Discord","3,999",20% Off,controllers-and-joysticks,noon
Sony DualSense Edge Wireless Controller for PlayStation 5 (Official Version) - White/Black,"13,999",15% Off,controllers-and-joysticks,noon
onikuma Onikuma Gaming Mouse CW921 USB,175,N/A,controllers-and-joysticks,noon
MARVO H8311 Wired 3.5mm Stereo Sound Headphone Computer Gaming Headphone with Adjustable Microphone Boom & Powerful Bass Sounds,299,33% Off,controllers-and-joysticks,noon
"Logitech Logitech G F310 Wired Gamepad, Controller Console Like Layout, 4 Switch D-Pad, 1.8-Meter Cord","1,225",N/A,controllers-and-joysticks,noon
Point GAMEPAD DOUBLE Vibration POINT COLOR BUTTON PT707,265,24% Off,controllers-and-joysticks,noon
"P47 Wireless Gaming Headset, Bluetooth 5.0 Cat Ear Headphones, Kids Headphones,LED Light Up Bluetooth Over Ear Headphones for Kids and Adults Wearing(Gray))",290,N/A,controllers-and-joysticks,noon
Altec Lansing ALGH9602 Gaming Headset - Mesh Earcups - Noise Cancelling Microphone - Inline Volume Control - Breaded Cable,499,16% Off,controllers-and-joysticks,noon
"onikuma K6 RGB Colour Changeable Gaming Headset with Stereo Surround Sound, Noise-Canceling Microphone, (Black)",800,N/A,controllers-and-joysticks,noon
"REDRAGON REDRAGON M909 EMPEROR RGB Gaming Mouse - Optical Sensor 12,400 DPI - 7 Programmable Buttons - Software Support","1,040",33% Off,controllers-and-joysticks,noon
AULA Aula F2058 Full Mechanical Gaming Keyboard With Rainbow Backlit LED -  Switches |Arabic/English,925,N/A,controllers-and-joysticks,noon
REDRAGON K681 MG-RGB-PRO Cyrus PRO 75% layout wireless Gasket mounted gaming mechanical keyboard 75% improved layout BT-2.4G-Wired provides better typing experience Hot swappable  Customized handle design for easy control,"3,499",5% Off,controllers-and-joysticks,noon
"Maono PD100X XLR/USB Gaming Microphone with Software, Dynamic PC Microphone with RGB for Streaming Podcast Vocal Recording, Computer Mic with Noise Cancellation, Mute Button, Gain Knob, Desktop Stand","1,999",33% Off,controllers-and-joysticks,noon
REDRAGON Redragon K505 Yaksa Gaming Keyboard | 7-Colour Backlight | 12 Multimedia Keys,"1,099",31% Off,controllers-and-joysticks,noon
AULA S31 Gaming Mouse Pro LED Wired Gaming Mouse with Breathing Backlight Effect | High End,225,35% Off,controllers-and-joysticks,noon
Forev Wired Gaming Keyboard With Esports Light,449,N/A,controllers-and-joysticks,noon
"Spark Gaming Headset , Comfortable RGB Caps Headset H101 , With USB and 7.1 Audio Cable , Noise Cancelling MIC , Surround Sound 360 Audio Directional Pinpoint , 110dB High Sensitivity , Captures Sound Source at all Distance , Compatible With PS/4 , PS/5 , XBOX , Switch - Black",495,23% Off,controllers-and-joysticks,noon
"REDRAGON GS580 RGB Desktop PC Speakers, 2.0 Channel Enhanced Sound and Volume Control with 3.5mm Cable - Black","1,349",37% Off,controllers-and-joysticks,noon
"REDRAGON Redragon BM-2638 Wireless Mouse – 2,400 DPI (Black)",450,N/A,controllers-and-joysticks,noon
"Generic V8 RGB Gaming Headset, 7.1 Surround Sound with Microphone, For Games",450,24% Off,controllers-and-joysticks,noon
Forev For Forev FV-G304 Wireless Mouse – 2.4G Wireless office business mic – 6 Buttons – 3200DPI – Energy saving – ON/OFF Button – Ergonomic Design – Effective distance 10m – (1x AA Battery) | Black,310,N/A,controllers-and-joysticks,noon
Sony DualSense Wireless Controller For PlayStation 5 - Pink,"4,499",N/A,controllers-and-joysticks,noon
Zero Zero ZR-1730 Wired Gaming Mouse with RGB Lighting Black,145,N/A,controllers-and-joysticks,noon
Zero Zero ZR-5001 GamePad Trubo Joystick USB 1.5 meter cable - Black,280,N/A,controllers-and-joysticks,noon
onikuma K19 Gaming Wired Headset With Microphone For PS4/PS5/XOne/XSeries/NSwitch/PC,700,N/A,controllers-and-joysticks,noon
PXN V900 Gaming Steering Wheel PC Racing Wheel for PS3/PS4/PC Windows/Switch /Xbox One/Xbox Series X/S 270/900 Rotate with Pedal,"6,880",N/A,controllers-and-joysticks,noon
"REDRAGON Redragon GS500 Stentor PC Gaming Speaker, 2.0 Channel Stereo Desktop Computer Speaker with Red Backlight",990,34% Off,controllers-and-joysticks,noon
"Forev Wireless Keyboard and Mouse Set QW07, 2.4ghz 84 key used for computers, phones, desktop computers, macbooks , Double AA Battery Included , range of up to 10 meters - pink","1,375",18% Off,controllers-and-joysticks,noon
"REDRAGON M814 AXE PRO RGB Tri-Mode 2.4G/USB-C/Bluetooth Rechargeable Gaming Mouse – 8,000 DPI (Black)","1,250",35% Off,controllers-and-joysticks,noon
"REDRAGON Redragon DORA GS512 Wireless RGB Desktop Speakers, 2.0 PC Computer Stereo Soundbar","1,710",37% Off,controllers-and-joysticks,noon
HP Virtual 7.1 Gaming Headset With LED Backlit,400,32% Off,controllers-and-joysticks,noon
AULA AULA Wind S11 Pro Wired Gaming Mouse - RGB Backlight with Colorful Effects - Lightweight Ergonomic Design - Adjustable DPI up to 3600 – white with babay blue.,500,N/A,controllers-and-joysticks,noon
"Logitech G502 X Wired Gaming Mouse - LIGHTFORCE hybrid optical-mechanical primary switches, HERO 25K gaming sensor, compatible with PC - macOS/Windows","4,980",16% Off,controllers-and-joysticks,noon
Sony PlayStation 5 DualSense Wireless Controller - Volcanic Red,"6,400",N/A,controllers-and-joysticks,noon
Sony Playstation US 10 USD Gift Card,655,N/A,controllers-and-joysticks,noon
DOBE Silicone Case For PS4 Controller,149,N/A,controllers-and-joysticks,noon
Memo DLA8 Phone Cooler,850,14% Off,controllers-and-joysticks,noon
Rapoo Gaming Headset For Pc With 7.1 Stereo Surround Sound,640,N/A,controllers-and-joysticks,noon
"GAMDIAS Poseidon M2 ( 4-IN-1 ) Compo Multi-Color Backlight , Breath Lighting Headset With 40mm Driver Unit",850,39% Off,controllers-and-joysticks,noon
DOBE Silicone Case For PS4 Controller,149,N/A,controllers-and-joysticks,noon
Crash Gamepad With Analog X5 Double Wireless,649,18% Off,controllers-and-joysticks,noon
"REDRAGON Redragon H270 RGB Gaming Headset with Microphone, Wired, Compatible with Xbox One, Nintendo Switch, PS4, PS5, PC, Laptops and Nintendo Switch (Black)",988,34% Off,controllers-and-joysticks,noon
VSP VM03 Gaming Mechanical Keyboard - Hot Swappable Blue Switch (Outemu) - Aluminum Alloy Frame - Rainbow LED,875,12% Off,controllers-and-joysticks,noon
2B 2B GP193 Wireless Single Gamepad PC & PlayStation 4 - Black Shell,"1,299",N/A,controllers-and-joysticks,noon
cardoo CardoO VR Box Pro – Wired VR Headset with Lightning Cable | Immersive VR Glasses with 360° Panoramic View | Built-in Wired Headphones,"1,499",25% Off,controllers-and-joysticks,noon
cardoo cardoO VR Box Pro – Wired VR Headset with Type-C Cable | Immersive VR Glasses with 360° Panoramic View | Built-in Wired Headphones,"1,499",25% Off,controllers-and-joysticks,noon
"cardoo cardoO VR Box Max – 5.3 Bluetooth VR Headset, Premium VR Glasses for Android and iOS Mobile Phones (4.8 to 7.0) | 360° Panoramic View | iMax Cinema | Built-in Headphones","1,999",33% Off,controllers-and-joysticks,noon
"HP Wireless Mouse 2.4ghz , With Micro Receiver - XS268",175,41% Off,controllers-and-joysticks,noon
"COOLER MASTER Master Liquid 360L Core ARGB 360mm Close-Loop AIO Liquid Cooler, ARGB Sync, Gen S Coldplate Pump, 120mm PWM, CryoFuze 14W/Mk, AMD Ryzen AM5/AM4, Intel LGA1700/1200 (MLW-D36M-A18PZ-RW)","3,799",30% Off,controllers-and-joysticks,noon
"cardoo CardoO VR Box Go – Lightweight VR Headset, VR glasses for Android and iOS Mobile Phones (4.8 to 7.0) | 360° Panoramic View | Multi-Function Button",999,33% Off,controllers-and-joysticks,noon
Generic Red Magic E-Sports Gaming Controller,"1,585",60% Off,controllers-and-joysticks,noon
"Generic Virtual Reality 3D Cinema Game VR Helmet 1080P Smart VR Glasses 4.7""",200,N/A,controllers-and-joysticks,noon
steelseries Qck Gaming Surface - Heavy Large Gaming Mousepad with Thick Cloth Peak Tracking And Stability Optimized For Sensors,"1,699",15% Off,controllers-and-joysticks,noon
Generic Energy Case Protective Carrying Case for PS4 (Black),244,59% Off,controllers-and-joysticks,noon
JeDEL HS-100 USB Headset - Noise Cancelling Microphone - In-Line Volume Control - Mic On/off Switch,420,N/A,controllers-and-joysticks,noon
"JeDEL GH-558 RGB Gaming Headset, 7.1 Surround Sound PS4 Headset with Microphone, For Games",440,N/A,controllers-and-joysticks,noon
XTRIKE ME XTRIKE ME GM-209W Sensor: Optical DPI: 1200/1800/2400/3600/4800/8000 Buttons: 6 Switch rating: 3 million clicks Backlight: 7 colors Interface: USB 2.0 Cable length: 1.5 m Weight: 65 g Size: 125x 66x 37mm,352,N/A,controllers-and-joysticks,noon
"Maono PD200XS XLR/USB Dynamic Microphone Kit, RGB Podcast Mic with Software, Mute, Gain Knob, Volume Control, Boom Arm for Streaming, Gaming, Voice-Over, Recording","2,999",N/A,controllers-and-joysticks,noon
أفالون سماعة الألعاب REVOO - صوت محيطي ستريو - إضاءة LED زرقاء,465,28% Off,controllers-and-joysticks,noon
فوريف ماوس مكتب لاسلكي FV-386 – 4 أزرار صامتة 2.4 جيجا هرتز، مدى 10 متر – تصميم بكرة غير قابلة للانزلاق 1600 نقطة في البوصة، أخضر,265,33% Off,controllers-and-joysticks,noon
Gravastar Gravastar Sirius Pro TWS Earbuds War Damaged Yellow,"4,899",N/A,controllers-and-joysticks,noon
"Marvo laptop cooling fan, drone shape, supports up to 17.3 inches, LED lighting, Extra mobile phone Holder to Release the Table Space black, FN-41","1,010",43% Off,controllers-and-joysticks,noon
Zero Zero ZR-5001 GamePad Trubo Joystick USB 1.5 meter cable - Blue,280,N/A,controllers-and-joysticks,noon
Logitech Logitech Driving Force Racing Shifter For G29 And G920 Wheels,"3,490",8% Off,controllers-and-joysticks,noon
"REDRAGON Wireless Gaming Headset H858 with 3-Mode , 7.1 Surround Sound, 53 mm Drivers for phone and PC","3,799",15% Off,controllers-and-joysticks,noon
onikuma K6 Over-Ear Gaming Wired Headset For PS4/PS5/XOne/XSeries/NSwitch/PC,470,30% Off,controllers-and-joysticks,noon
JOYROOM 60W Super Fast Charging Cable Type-C to Type-C Compatible with All Phones - N1-600 - Black,285,N/A,controllers-and-joysticks,noon
"Logitech G502 Hero High Performance Wired Gaming Mouse, Hero 25K Sensor, 25,600 DPI, RGB, Adjustable Weights, 11 Programmable Buttons, On-Board Memory, PC And Mac","2,900",12% Off,controllers-and-joysticks,noon
"REDRAGON M693 Wireless Gaming Mouse, 8000 DPI Wired/Wireless Gamer Mouse with 3 Mode Connection, Bluetooth & 2.4G Wireless, 7 Macro Buttons, Long Lasting Battery Capacity and RGB for PC/Mac/Laptop","1,750",31% Off,controllers-and-joysticks,noon
Lenovo Gaming Mouse Pad Black/Red,599,N/A,controllers-and-joysticks,noon
Sony DualSense Wireless Controller For PlayStation 5 - Starlight Blue,"4,444",N/A,controllers-and-joysticks,noon
"REDRAGON Orpheus PC Gaming Speakers, 2.0 Channel Stereo, Desktop Computer Sound Bar, With Compact Maneuverable Size, 3W x 2 Maximum Power, Black | GS550","1,296",N/A,controllers-and-joysticks,noon
havit MS871 Wired Mouse black,85,43% Off,controllers-and-joysticks,noon
Standard Headphone Gaming Stereo 7.1 Surround Sound RGB,"1,039",52% Off,controllers-and-joysticks,noon
"KontrolFreek KontrolFreek FPS Freek Galaxy White For Playstation 4 (PS4) And Playstation 5 (PS5) | Performance Thumbsticks | 1 High-Rise, 1 Mid-Rise | White",270,N/A,controllers-and-joysticks,noon
HYPERX SoloCast USB Microphone,"2,675",N/A,controllers-and-joysticks,noon
Standard GM-3502LR Standard Gaming Headphones (3.5mm) Surround Sound - Flexible Unbreakable Volume Control Microphone Surround Sound 2-Jack to 1-Jack (gift)- Adapter for ps4 - mobile -Use  RGB lights,589,48% Off,controllers-and-joysticks,noon
RAZER Blackshark V2 X For Playstation,"3,999",11% Off,controllers-and-joysticks,noon
DOBE 2 In 1 Dual Charging Dock Station Charger Double Charger Standers For Sony PS4 Wireless Controller PS3 PS4 Controllers PlayStation 3 4,185,39% Off,controllers-and-joysticks,noon
"MARVO Gaming Mouse M291 White - With 7 colors breathing backlight , Adjustable up to 6400 DPI, Ergonomic Design, Gaming Grade Optical Sensor with 6 Programmable Buttons",350,9% Off,controllers-and-joysticks,noon
Sony DUALSHOCK 4 Wireless Controller For PlayStation 4,985,N/A,controllers-and-joysticks,noon
"REDRAGON A113 Bullet-B Tactile Mechanical Switch, 3-Pin Plate Mounted Blue Switches Equivalent, Hot-Swappable DIY Keyboard Clicky Switch Mod, 50 Million Click(24 pcs Switches, Keycap + Switch Puller)",550,41% Off,controllers-and-joysticks,noon
REDRAGON K530 Draconic 60% Compact RGB Wireless Gaming Keyboard,"1,999",45% Off,controllers-and-joysticks,noon
Generic Mobile Desktop Stand – Solid Aluminum Holder For Mobile - Silver,145,38% Off,controllers-and-joysticks,noon
"REDRAGON GS511 Wireless RGB Desktop Speakers, 2.0 PC Gaming Soundbar w/BT 5.3/USB Mode, Dual-Play Design, Rich Stereo Sound and Bass, RGB Backlight & All-in-one Control, USB Powered","1,599",N/A,controllers-and-joysticks,noon
"havit MP830 Mouse pad, Large Size Design, Non-slip rubber base effectively, Waterproofing, 9003003mm, Black | HVMP-MP830-BK",225,14% Off,controllers-and-joysticks,noon
Cougar joystick controller for pc 2 pcs,350,N/A,controllers-and-joysticks,noon
"COOLER MASTER MasterGel REGULAR High Performance Heatsink Thermal Paste, 5 W/mK Thermal Conductivity Compound for CPU and GPU Coolers, Flat-Nozzle Applicator for Easy Use",399,N/A,controllers-and-joysticks,noon
GameSir T4 Kaleid Wired USB Type C Gaming Controller RGB For PC Switch Android,"2,699",5% Off,controllers-and-joysticks,noon
REDRAGON M910 High Precision Wired Gaming Mouse,965,57% Off,controllers-and-joysticks,noon
