title,price,offer,category,site
"REDRAGON FIZZ K617 60% Mechanical Keyboard, Red Key Switches, Hot-Swappable, Detachable Type-C Cable, Pro Software Customizable RGB, Full Rollover 61-Keys, White/Gray | K617-RGB","1,485",25% Off,controllers-and-joysticks,noon
Microsoft Wired Gaming Controller For Xbox 360,375,46% Off,controllers-and-joysticks,noon
"Hunterspider V4 Gaming Headset for Xbox One, PS4, PC, Controller, Noise Cancelling Over Ear Headphones with Mic, LED Light Bass Surround Soft Memory Earmuffs for PS2 Mac",499,37% Off,controllers-and-joysticks,noon
"JITOPKEY Mouse Pad with Stitched Edge, Size 260X210X2MM Premium and Portable Textured Mouse Mat, Non-Slip Rubber Base Mousepad for Laptop, Computer & PC",50,74% Off,controllers-and-joysticks,noon
"Aukey Gaming Mouse Pad Large XL (900 X 400 X 3 MM) Thick Extended Mouse Mat Non-Slip Spill-Resistant Desk Pad with Special-Textured Surface, Anti-Fray Stitched Edges for Keyboard, PC",240,N/A,controllers-and-joysticks,noon
onikuma K20 Gaming Wired Headset With Microphone For PC,484,N/A,controllers-and-joysticks,noon
Meta Quest 3S 128GB White,"22,999",N/A,controllers-and-joysticks,noon
"cardoo cardoO VR Box Max – 5.3 Bluetooth VR Headset, Premium VR Glasses for Android and iOS Mobile Phones (4.8 to 7.0) | 360° Panoramic View | iMax Cinema | Built-in Headphones","1,999",33% Off,controllers-and-joysticks,noon
"Maono PD200XS XLR/USB Dynamic Microphone Kit, RGB Podcast Mic with Software, Mute, Gain Knob, Volume Control, Boom Arm for Streaming, Gaming, Voice-Over, Recording","2,799",20% Off,controllers-and-joysticks,noon
"EKSA E900 Gaming Headset for PC,PS4,Xbox One S/X, Nintendo Switch  - Computer Headset with Detachable Noise Cancelling Mic, 7.1 Surround Sound, 50MM Driver - Headphones with Microphone",440,N/A,controllers-and-joysticks,noon
REDRAGON M711 RGB Wired Gaming Mouse Black,875,N/A,controllers-and-joysticks,noon
"MARVO CM-390 PRO 6-in-1 STARTER KIT ( Keyboard, Mouse, Headset, Mouse Pad & Speakers)",789,N/A,controllers-and-joysticks,noon
"ZINGYOU ZY-UA2 USB Condenser Cardioid Microphone Kit , 96KHz/24Bit Plug & Play for PC Recording, Gaming, Live Streaming, Voice Over, YouTube, Twitch,with Upgraded Boom Arm,",999,33% Off,controllers-and-joysticks,noon
T-DAGGER T-DAGGER TGK313 Bora Gaming Mechanical Keyboard - Rainbow LED Lighting - Hot Swappable Switches Blue Switch,850,N/A,controllers-and-joysticks,noon
"Beexcellent GM5 Gaming Headset, 7.1 Surround Sound PS4 Headset with Microphone, For Games, PC Headphones, Heavy Bass, Telescopic, Noise Isolation, Wired, FPS Compatible, LED Light",449,43% Off,controllers-and-joysticks,noon
"REDRAGON M691 MIST Wireless Gaming Mouse - 4,800 DPI Optical Sensor - Ergonomic Design with Thumb Rest - 3 Side Buttons - Rapid Fire Button",657,N/A,controllers-and-joysticks,noon
"EKSA E900 Gaming Headset for PC,PS4,Xbox One S/X, Nintendo Switch  - Computer Headset with Detachable Noise Cancelling Mic, 7.1 Surround Sound, 50MM Driver - Headphones with Microphone",475,52% Off,controllers-and-joysticks,noon
lecoo HT403 RGB Gaming Headset - 50mm Audio Driver - Adjustable Headband - Realistic Sound Quality - Easy Control inline volume control,399,33% Off,controllers-and-joysticks,noon
Ipega Multifunctional PS5 Console Stand - Charge 2 PS5 controllers - Storage up to 14 game discs - headphones or VR glasses Stand,350,56% Off,controllers-and-joysticks,noon
"cardoo CardoO VR Box Go – Lightweight VR Headset, VR glasses for Android and iOS Mobile Phones (4.8 to 7.0) | 360° Panoramic View | Multi-Function Button",999,33% Off,controllers-and-joysticks,noon
PXN Game Steering Wheel For PlayStation/Xbox/Switch/PC With Pedal -wired,"5,399",10% Off,controllers-and-joysticks,noon
"RAZER Razer BlackShark V2 X Gaming Headset: 7.1 Surround Sound, 50mm Drivers, Memory Foam Cushion, for PC, PS4, PS5, Switch, Xbox One, Xbox Series X|S, Mobile, 3.5mm Audio Jack, Classic Black","3,999",N/A,controllers-and-joysticks,noon
AULA S20 Usb Wired Gaming Mouse |Programmable |Optical Ergonomic Mouse |With Breathing Led Lights | For Pc Laptop,180,N/A,controllers-and-joysticks,noon
Sony DualSense Wireless Controller For PlayStation 5 - White,"4,103",10% Off,controllers-and-joysticks,noon
"REDRAGON M612 Predator RGB Wired Optical Gaming Mouse, 8000 DPI, 9 Programmable Buttons, 5 Backlit Modes, Software Supports DIY Keybinds Rapid Fire Button, Black | Predator M612-RGB",725,27% Off,controllers-and-joysticks,noon
Sony DOUBLESHOCK Controller For Playstation 4,649.95,45% Off,controllers-and-joysticks,noon
REDRAGON K552 Rainbow Mechanical Gaming Keyboard Blue Switch 87 Key Tkl Design,"1,399",24% Off,controllers-and-joysticks,noon
إتش بي ماوس كمبيوتر لاسلكي S4000، 1600 نقطة في البوصة,149,69% Off,controllers-and-joysticks,noon
Alpha X Wireless Controller For PlayStation 4,634.95,N/A,controllers-and-joysticks,noon
JeDEL HS-100 USB Headset - Noise Cancelling Microphone - In-Line Volume Control - Mic On/off Switch,449,25% Off,controllers-and-joysticks,noon
"Logitech H340 USB Headset, Plug And Play, Noise Cancelling Microphone, USB Type A, Adjustable Headband, Black | 981-000475","1,269",33% Off,controllers-and-joysticks,noon
"REDRAGON H510-RGB Zeus X Wired Gaming Headset, Ergonomic Design, 7.1 Surround Sound, 53mm Drive, Detachable Microphone & RGB Lights, 3.5mm Cable, USB Control Box & 3.5mm Jack Input, Black | H510-RGB","2,549",N/A,controllers-and-joysticks,noon
"Forev Portable  Wired Keyboard Hot-Swap Gaming , E-Sports 75% Wired Mechanical Lightweight 82 Key (RGB) With Type-C Cable ,FV-K82 Good Keyboard For Gamer","1,250",28% Off,controllers-and-joysticks,noon
Somic G910i USB Gaming Headset - 7.1 Surround Sound With Vibration Bass & Software,599,33% Off,controllers-and-joysticks,noon
"REDRAGON S131 Dynamic Gaming Duo Mechanical Keyboard K617 Red Switch RGB + Gaming Mouse M711 Optical sensor 12,400 DPI","2,380",N/A,controllers-and-joysticks,noon
Zero Colorful Rgb Mouse,85,N/A,controllers-and-joysticks,noon
"Maono Gaming Microphone with Noise Cancellation, USB Condenser RGB Mic for Streaming, Podcasts, Twitch, YouTube, Discord, Plug and Play for PC, Computer, Mac, PS4, PS5, DGM20S","2,099",30% Off,controllers-and-joysticks,noon
HP DHE-8005T RGB USB Gaming Headset - 7.1 Surround Sound - 40MM Drivers - RGB Backlit Housing - Hi-Res Mic,399,42% Off,controllers-and-joysticks,noon
REDRAGON Gcp500 Ivy Laptop Cooler - Support 12 to 15.6 Inch - 2 USB Port - Fan Speed Control - Aluminum Panel Faster Cooler - RGB Light Mode-Phone Holder,"1,325",38% Off,controllers-and-joysticks,noon
"Logitech Logitech H111 Wired Headset, Stereo Headphones With Noise-Cancelling Microphone, 3.5 mm Audio Jack, PC/Mac/Laptop/Smartphone/Tablet",510,N/A,controllers-and-joysticks,noon
"Logitech G29 Driving Force Racing Wheel and Floor Pedalsfor PS5, PS4,PS3 And PC - Black","15,999",13% Off,controllers-and-joysticks,noon
PXN 5-In-1 Racing Wheel For Xbox One/Xbox Series X/S/PC/PS3/PS4/Nintendo Switch,"3,185",N/A,controllers-and-joysticks,noon
"Monster Wired gaming headset , stereo headphone with red LED light for pc and laptop with 3.5mm port , can use it in home , office and out door",325,33% Off,controllers-and-joysticks,noon
Memo MEMO AK-66 - PUBG game controller - compatible with all phone devices - ultra-sensitive buttons L1*L2*R1*R2 - ergonomic design suitable for playing for long periods,250,N/A,controllers-and-joysticks,noon
"REDRAGON ZEUS 2, Wired headset, with Adapter, 7.1 Surround, 53mm Drivers, 110±3dB Sensitivity, Detachable Mic, Adjustable Headband With Lightweight Durable Made Steel Frame, Black | ZEUS 2 H510-1","2,149",28% Off,controllers-and-joysticks,noon
REDRAGON M609 Phaser 6 Buttons Optical Sensor Gaming Mouse Black/Red,505,27% Off,controllers-and-joysticks,noon
"REDRAGON G808 HARROW PRO Wireless,Wired Gamepad Controller","1,330",N/A,controllers-and-joysticks,noon
Meta Quest 3S 256GB — Get Batman: Arkham Shadow and a 3-Month Trial of Meta Quest+ Included — All-in-One Headset White,"24,117",N/A,controllers-and-joysticks,noon
"REDRAGON H270 RGB Gaming Headset with Microphone, Wired, Compatible with Xbox One, Nintendo Switch, PS4, PS5, PC, Laptops (White)",990,N/A,controllers-and-joysticks,noon
Forev FV-F6 Wired Gaming Illuminated Keyboard (Black),425,29% Off,controllers-and-joysticks,noon
"JeDEL Mechanical Gaming Keyboard, model KL-103 for computer and lap top (black/gray) RGB Full size with 87 key, cable USB Speed interface , blue switch, adjustable height in to give comfort to the hand while playing . It can be used at home, office and personal use.",775,51% Off,controllers-and-joysticks,noon
Meta Quest 3 Advanced All-In-One VR Headset 512GB White,"38,000",N/A,controllers-and-joysticks,noon
"New Bee H361 USB Headset with Microphone, Computer Headset with in-line Mute & Volume Control, 3.5mm/ USB/USB-C Wired Headset for Laptop, Skype, Zoom, Call Center, Meetings, Webinar, Home","1,099",45% Off,controllers-and-joysticks,noon
إتش بي سماعة رأس ستريو للألعاب DHE-8011UM، سماعة رأس بتأثير إضاءة LED مع ميكروفون، طول الكابل 2.1 متر والتحكم في مستوى الصوت,475,40% Off,controllers-and-joysticks,noon
"JITOPKEY Mouse Pad with Stitched Edge, Size 260X210X2MM Premium and Portable Textured Mouse Mat, Non-Slip Rubber Base Mousepad for Laptop, Computer & PC",82,N/A,controllers-and-joysticks,noon
"New Bee H362 USB Headset 270° Rotatable Microphone Computer Headset in-line Controls Call Center Stereo Wired PC Headset Ultra Comfort for Skype, Zoom, Laptop, Phone, PC, Tablet","1,199",40% Off,controllers-and-joysticks,noon
Generic Gaming Mouse Pad,31,63% Off,controllers-and-joysticks,noon
Forev FV-Q1S Rainbow Wired Gaming Keyboard English & Arabic,399,6% Off,controllers-and-joysticks,noon
"REDRAGON K662 Gwern Dual Mode Wireless, Bluetooth Gaming Mechanical Keyboard, Red Switch","1,699",32% Off,controllers-and-joysticks,noon
"PXN PC Racing Wheel,PXN V3II 180 Degree Universal Usb Car Sim Race Steering Wheel with Pedals for PS3,PS4,Xbox One,Xbox Series X/S,Nintendo Switch","3,150",14% Off,controllers-and-joysticks,noon
"REDRAGON M908 Impact RGB LED MMO Mouse with Side Buttons Optical Wired Gaming Mouse with 12,400DPI, 20 Programmable Mouse Buttons","1,269",37% Off,controllers-and-joysticks,noon
Lenovo Thinkplus G81B USB RGB Gaming Headset - 7.1 Surround Sound - Noise Cancelling Microphone,499,16% Off,controllers-and-joysticks,noon
"FIFINE A6T AMPLIGAME USB Condenser MICROPHONE with Boom Arm, Pop Filter, Mute Button RGB FOR STREAMING ON PC/LAPTOP/PS4/5","2,499",37% Off,controllers-and-joysticks,noon
XTRIKE ME XMC-03 USB RGB Gaming Streaming Microphone Live Streaming Desktop Omnidirectional mic - 12 RGB Lighting Modes - 360 Degree rotatable body - Shielded Cable For PC,599,40% Off,controllers-and-joysticks,noon
cardoo cardoO VR Box Pro – Wired VR Headset with Type-C Cable | Immersive VR Glasses with 360° Panoramic View | Built-in Wired Headphones,"1,499",25% Off,controllers-and-joysticks,noon
AULA F2066-Ii Gaming Mechanical Keyboard -Anti-Ghosting Blue Switch-Software -For Laptop & Pc,849,N/A,controllers-and-joysticks,noon
Sony DualSense Wireless Controller For PlayStation 5 - Midnight Black,"4,342",N/A,controllers-and-joysticks,noon
DOBE Dual Charging Dock With USB Cable For PlayStation 4 Wireless Controller,394.95,N/A,controllers-and-joysticks,noon
"XTRIKE ME GM226 RGB Gaming Mouse - Optical Sensor 7,200 DPI - 7 Programmable Buttons - With Software",350,29% Off,controllers-and-joysticks,noon
"Logitech Logitech G502 X Wired Gaming Mouse - LIGHTFORCE hybrid optical-mechanical primary switches, HERO 25K gaming sensor, compatible with PC - macOS/Windows - Black","4,199",30% Off,controllers-and-joysticks,noon
"GAMDIAS Zeus M4 RGB Gaming Mouse 12,800 DPI + NYX E1 Mouse Mat 23.5 X 18 CM",350,29% Off,controllers-and-joysticks,noon
REDRAGON GS815 Multi Soundbar Gaming Speaker,"4,400",48% Off,controllers-and-joysticks,noon
REDRAGON M607 USB Wired Programmable Gamer Mouse,795,35% Off,controllers-and-joysticks,noon
"HP Wireless Optical Gaming Mouse M100G , 2.4Ghz for pc and laptop , 1300 DPI , Black",170,51% Off,controllers-and-joysticks,noon
T-DAGGER T-DAGGER TGK313 BORA Gaming Mechanical Keyboard - Rainbow LED Lighting -TKL Size 87 Key - AR/EN Key Brown Switch,890,N/A,controllers-and-joysticks,noon
Sony DualSense Wireless PS5 Controller Midnight Black (Official Version),"4,249",6% Off,controllers-and-joysticks,noon
REDRAGON K552-RGB Kumara RGB LED Backlit Mechanical Gaming Keyboard - Black (Blue Switch),"1,660",33% Off,controllers-and-joysticks,noon
"KontrolFreek KontrolFreek FPS Freek Galaxy Black for Playstation 4 (PS4) and Playstation 5 (PS5) | Performance Thumbsticks | 1 High-Rise, 1 Mid-Rise | Black",175,41% Off,controllers-and-joysticks,noon
Gamma GAMMA GT-314 Gaming RGB usb pc speaker with lights,290,N/A,controllers-and-joysticks,noon
"REDRAGON Redragon K552 Mechanical Gaming Keyboard Rainbow LED Backlit Wired with Anti-Dust Proof Switches for Windows PC (Black, 87 Keys Blue Switches)","1,415",N/A,controllers-and-joysticks,noon
"REDRAGON K1NG M724 Wired Gaming Mouse, 42G Ultra-Light 12,400 Max DPI Optical Gaming Mouse with 5 Programmable Buttons, Ergonomic Natural Grip Build, Software Supports DIY Keybinds & DPI, White",875,N/A,controllers-and-joysticks,noon
"GameSir G7 SE Wired Controller for Xbox Series X|S, Xbox One & Windows 10/11, Plug and Play Gaming Gamepad with Hall Effect Joysticks/Hall Trigger, 3.5 mm Audio Jack","2,590",7% Off,controllers-and-joysticks,noon
"REDRAGON Gaming Controller G711 With 3 modes High-sensitivity joystick and buttons provide fast in-game response , Type-C charging port For PC/Ps3/Ps4/N-Switch/Android , 8 hours of battery life (Black)","1,949",N/A,controllers-and-joysticks,noon
HP Mouse Wireless Grey,275,38% Off,controllers-and-joysticks,noon
REDRAGON K568 DARK AVENGER Rainbow MECHANICAL GAMING KEYBOARD - (RED SWITCHES) - Spill-proof - Double Injection KeyCaps - Anti Ghosting All keys,"1,279",47% Off,controllers-and-joysticks,noon
RAZER Kraken X Lite Wired H/S,"2,039",11% Off,controllers-and-joysticks,noon
"XTRIKE ME GM316W RGB Gaming Mouse - Optical Sensor 7,200 DPI - Detachable Top Covers - Lightweight Only 67G (White)",375,37% Off,controllers-and-joysticks,noon
"JeDEL GH-558 RGB Gaming Headset, with Microphone, For Games",399,33% Off,controllers-and-joysticks,noon
REDRAGON Redragon K568R-BA Gaming Keyboard & Mouse Combo (Rainbow Mechanical Blue Switch M609 3200 DPI),"1,549",N/A,controllers-and-joysticks,noon
"2B 2B Wireless Single Game Pad , Turbo Dual Vibration , 3 in one (PC- PS2- PS3)","1,099",N/A,controllers-and-joysticks,noon
Cougar COUGAR T29 PS4 Wired Controller For PS4- blue,725,N/A,controllers-and-joysticks,noon
Logitech H110 Head-Mounted Stereo Headset With Adjustable Noise Reduction Microphone Grey,499,N/A,controllers-and-joysticks,noon
REDRAGON K552 Wired Mechanical Gaming Keyboard-Red Switch,"1,440",28% Off,controllers-and-joysticks,noon
Forev Wireless Optical office mouse 2.4GHz (FV-W388/pink) 1600dpi For PC and Laptop with 1 AA battery long life and smart power,295,39% Off,controllers-and-joysticks,noon
Sony DualSense Wireless PS5 Controller (Official Version) - Grey Camouflage,"4,295",N/A,controllers-and-joysticks,noon
Forev FV-F6 Wired Gaming Illuminated Keyboard (Black),399,N/A,controllers-and-joysticks,noon
Sony DualSense Wireless Controller for PlayStation 5 Cosmic Red (Official Version),"4,103",N/A,controllers-and-joysticks,noon
"REDRAGON Saving Offers Bundle (Redragon M606 Nothosaur Gaming Mouse 3200 DPI, 6 Buttons - Monster RGB Gaming Headset and Razer Goliathus Mouse Pad Extended Size (80 x 30 CM) )",880,N/A,controllers-and-joysticks,noon
"REDRAGON H260 HYLAS RGB Gaming Headset-With Microphone,Wired,Compatible With Xbox One,Nintendo Switch,PS4,PS5,PCS,LAPTOPS",850,17% Off,controllers-and-joysticks,noon
"HP Wired Office Mouse  M180 , with 4 Button , 7 Colors LED, 1600 DPI, for PC and Laptop Home Office, High Quality  - Black",250,N/A,controllers-and-joysticks,noon
"havit HAVIT GAMING HEADPHONES BLACK-GREEN H2002E with Noise Cancellation, Adjustable Headband, Gaming - Surround Headset","1,330",N/A,controllers-and-joysticks,noon
DOBE Silicone Case For PS5 Controller,160,N/A,controllers-and-joysticks,noon
Sony DualSense Wireless Controller for PlayStation 5 (Official Version) - White,"4,111",N/A,controllers-and-joysticks,noon
Forev Wired Backlit mouse with comforte grip - FV-136,190,N/A,controllers-and-joysticks,noon
REDRAGON GS570 Darknets Sound Bar with Dual Speakers,"1,425",40% Off,controllers-and-joysticks,noon
"MARVO M112 USB Wired Gaming Programmable Mouse Multi DPI Speed and RGB LED Lights, Black",270,N/A,controllers-and-joysticks,noon
GameSir Pack Of 2 Talons Finger Sleeves,260,N/A,controllers-and-joysticks,noon
Generic Large LED RGB Mouse Pad,235,51% Off,controllers-and-joysticks,noon
Forev FV-Q305s USB Backlighted Keyboard And Mouse - Compatible with PC & Laptop,490,24% Off,controllers-and-joysticks,noon
"Infurture G2 Wireless,Wired 3.5MM Gaming Headset with Detachable Noise Cancelling Mic, Battery 18Hour","1,199",40% Off,controllers-and-joysticks,noon
"ZINGYOU ZY-UA2 USB Condenser Cardioid Microphone Kit , 96KHz/24Bit Plug & Play for PC Recording, Gaming, Live Streaming, Voice Over, YouTube, Twitch,with Upgraded Boom Arm,",880,N/A,controllers-and-joysticks,noon
SUP 400 In 1 Portable Retro Handheld Console,500,N/A,controllers-and-joysticks,noon
REDRAGON REDRAGON K552 KUMARA PRO RGB Wireless Gaming Mechanical Keyboard - Blue Switches - Wireless 2.4Ghz | Bluetooth | Wired Type C Cable(Black),"2,790",20% Off,controllers-and-joysticks,noon
REDRAGON Reddragon K512 Shiva Dedicated Media Control Detachable Wrist Rest RGB Quiet Mechanical Feeling Gaming Keyboard with Multimedia Keys,"1,280",14% Off,controllers-and-joysticks,noon
"REDRAGON M914 NIX RGB Tri-Mode 2.4G/USB-C/Bluetooth Rechargeable Gaming Mouse – 10,000 DPI","1,290",48% Off,controllers-and-joysticks,noon
"GameSir Nova Lite 2.4g Wireless Controller for Windows PC, iPhone, Android, Switch & Steam Deck, Bluetooth Controller Gamepad with Hall Effect Trigger,Turbo,Rumble Vibration","2,273",N/A,controllers-and-joysticks,noon
FANTECH FANTECH Leviosa MCX01 USB Metal RGB Professional Gaming Stream Condenser Microphone Kit with Tripod and Pop Filter,"1,799",N/A,controllers-and-joysticks,noon
Forev FV-Q8 Wired Gaming Keyboard Esports Light-Emitting Office Desktop Laptop Wired Film Wired Keyboard (FV-Q1 White - Pink),449,N/A,controllers-and-joysticks,noon
"REDRAGON GM100 Seyfert Gaming Stream Microphone, With Pop Filter, 3.5mm Plug, 50Hz-16kHz Frequency, Sensitivity -30dB±3dB, Omni Condenser Mic, ≤2.2KΩ Impedance","1,275",35% Off,controllers-and-joysticks,noon
Sony Dualshock Wireless Controller For PlayStation 3,"1,275",N/A,controllers-and-joysticks,noon
Cougar COUGAR T29 PS4 Dualshock Wired Controller For PS4 -red,754,N/A,controllers-and-joysticks,noon
Rapoo RAPOO 7.1 Channel VH520 Gaming Headset,866,N/A,controllers-and-joysticks,noon
DOBE Dual Charging Dock With USB Cable For PlayStation 4 Wireless Controller,399,N/A,controllers-and-joysticks,noon
"REDRAGON K1NG M724 Wired Gaming Mouse, 42G Ultra-Light 12,400 Max DPI Optical Gaming Mouse with 5 Programmable Buttons, Ergonomic Natural Grip Build, Software Supports DIY Keybinds & DPI, Black",875,27% Off,controllers-and-joysticks,noon
FANTECH Gp12 Revolver Usb Gaming Controller – Pc / Ps3,740,N/A,controllers-and-joysticks,noon
"Altec Lansing Ergonomic Wired Mouse with Flanking Hand Rest – 6 Button , 3200DPI , 3D Rubber Roller / Ant Slip",299,14% Off,controllers-and-joysticks,noon
RAZER Razer DeathAdder Essential Wired Gaming Mouse Ergonomic Mice with 6400DPI Optical Sensor 5 Programmable Buttons Black (2021 Version),"1,685",N/A,controllers-and-joysticks,noon
"Logitech H390 Wired Headset for PC/Laptop, Stereo Headphones with Noise Cancelling Microphone, USB Type-A Interface, In-Line Controls, Works with Chromebook - Black","1,799",18% Off,controllers-and-joysticks,noon
COOLER MASTER MasterGel Pro V2 High Performance Thermal Compound with High CPU/GPU Conductivity W/m.k= 9m Design for CPU and GPU Coolers,370,11% Off,controllers-and-joysticks,noon
Rapoo Gaming Headset Wired Usb  VH310,650,N/A,controllers-and-joysticks,noon
HYPERX HyperX Cloud II Wired Gaming Headset - Black-Red,"4,899",18% Off,controllers-and-joysticks,noon
"REDRAGON S134 (WINTER EDTION) Combo Ultimate Gaming Rig 94% Mechanical Keyboard RGB Brown Switch, Mouse 7200 DPI Optical Sensor","2,299",N/A,controllers-and-joysticks,noon
VR Box Virtual Reality 3D Glasses Black/White,222,N/A,controllers-and-joysticks,noon
"XTRIKE ME GM316 RGB Gaming Mouse - Optical Sensor 7,200 DPI - Detachable Top Covers - Lightweight Only 67G (Black)",375,37% Off,controllers-and-joysticks,noon
"Google Google Stadia Bluetooth Gaming Controller, Wasabi","1,389",7% Off,controllers-and-joysticks,noon
Forev Wired Gaming Keyboard Esports Light-Emitting Office Desktop Laptop Wired Film Wired Keyboard (FV-Q8 Gray-Black),510,32% Off,controllers-and-joysticks,noon
MARVO Scorpion M112S Backlight Gaming Mouse With Rubber Scroll Wheel And Optical Sensor For Computer,279,29% Off,controllers-and-joysticks,noon
"Oivo PS5 Cooling Stand With Controller Charger, Cooling Station With 3-Level Speeds Cooling Fan, PS5 Controller Charging Doking Station With 15 Games Organizer & Headset Holder For Playstation 5 Console","1,445",N/A,controllers-and-joysticks,noon
AULA S608 Gaming Headset - RGB LED Backlight - 3D Surround Sound - Dual 50mm Drivers - Noise Reduction Microphone (120 Omnidirectional) - Soft Memory Eartips - Wired 2*3.5mm AUX + USB for Lighting for PC/PS4-5/Xbox one/Mobile | Black,475,26% Off,controllers-and-joysticks,noon
Sony PlayStation 5 DualSense Wireless Controller - Cobalt Blue,"6,125",N/A,controllers-and-joysticks,noon
"Gigamax Multimedia stereo headphones. Integrated volume control located on headset cord. Adjustable microphone arm , 3.5mm plug , GM530 deep bass and comfortable design , soft headset caps with leather headband for DVD player , TV and PC - Black",295,34% Off,controllers-and-joysticks,noon
AULA White S20 USB Wired Gaming Mouse Programmable 2400DPI Optical Ergonomic Mouse with 4-color Breathing Light for PC Laptop White,205,36% Off,controllers-and-joysticks,noon
"BENGOO KM-1 Wireless RGB Gaming Mouse,Optical 3,200 DPI Honeycomb Shell, 8  Buttons, 3 Adjustable DPI, USB Receiver for Laptop PC Mac",349,N/A,controllers-and-joysticks,noon
REDRAGON M601 RGB Gaming Mouse Backlit WiRed Ergonomic,649,40% Off,controllers-and-joysticks,noon
Generic Gaming Console Wireless Controller For PlayStation 4,601.25,59% Off,controllers-and-joysticks,noon
"Cosmic Byte GS410 Gaming Headset, 7.1 Surround Sound PS4 Headset with Microphone, For Games",399,33% Off,controllers-and-joysticks,noon
"REDRAGON GS813 Wireless Desktop Speakers, 2.0 Channel Bookshelf Speaker with Powerful 20W Output, BT 5.0/3.5mm AUX Connection, Enhanced Bass/Treble Knob Control and TF Card/USB Flash Drive Supported","4,250",34% Off,controllers-and-joysticks,noon
onikuma K1b Pro Over-Ear Gaming Headset With Mic - PS4/PS5,495,38% Off,controllers-and-joysticks,noon
"Point Wireless Gamepad - 7 in 1 for PS1, PS2, PS3, Laptop, PC, USB, Android TV, Android Media Box - with battery - black Color",440,26% Off,controllers-and-joysticks,noon
"REDRAGON G808 Harrow Rechargeable Wireless Gamepad With USB Receiver, Joystick with Dual Vibration, for Windows PC, PS3, Playstation, Android","1,180",N/A,controllers-and-joysticks,noon
lecoo HT403 RGB USB Gaming Headset - 50mm Audio Driver - Adjustable Headband - Realistic Sound Quality - Easy Control inline volume control,450,24% Off,controllers-and-joysticks,noon
"havit Havit Hv-Mp861 Mousepad With Premium Fine-Mesh & Anti-Slip Rubber Base,700*300*3Mm, Black",186,9% Off,controllers-and-joysticks,noon
"Aukey Gaming Mouse Pad Large XL (900 X 400 X 4 MM) Thick Extended Mouse Mat Non-Slip Spill-Resistant Desk Pad with Special-Textured Surface, Anti-Fray Stitched Edges for Keyboard, PC - Black",240,51% Off,controllers-and-joysticks,noon
"Nintendo Charger And Lite OLED with 5FT Charging Cable, AC Power Supply Adapter With Charging Cable Cord, Output 15V2.6A Support Switch TV Dock Mode",950,50% Off,controllers-and-joysticks,noon
T-DAGGER T-DAGGER TGK313 Bora Gaming Mechanical Keyboard - Rainbow LED Lighting - Hot Swappable Switches,925,N/A,controllers-and-joysticks,noon
Sony PlayStation 5  DualSense Charging Station,"1,359",25% Off,controllers-and-joysticks,noon
"REDRAGON Gainer M610 Gaming Mouse Ergonomic Dedicated DPI Button USB Wired Optical Pixart Sensor 3168 for Desktop, Laptop, Gamer and Work",495,34% Off,controllers-and-joysticks,noon
Zero Zero ZR-1800 Wired Gaming Mouse with RGB Lighting Black,205,N/A,controllers-and-joysticks,noon
تيكنو زون ماوس تكنو زون للألعاب v66 FPS 6600 مع 16.8 مليون لون RGB 10000 نقطة في البوصة مع برنامج,599,20% Off,controllers-and-joysticks,noon
"Forev Portable  Wired Keyboard Hot-Swap Gaming , E-Sports 75% Wired Mechanical Lightweight 82 Key (RGB) With Type-C Cable ,FV-K82 Good Keyboard For Gamer","1,190",32% Off,controllers-and-joysticks,noon
REDRAGON H280 MEDEA RGB Gaming Headset – Stereo (Black),999,16% Off,controllers-and-joysticks,noon
Gamma GAMMA GT-313 Gaming RGB Usb pc speaker with lights,299,14% Off,controllers-and-joysticks,noon
"eMeet HS20 USB Computer Headset with Microphone , Wired Office Headphones with 360° Omni-Directional Mic, USB/3.5mm Jack, in-Line Control, Mute Button, USB Headset for Skype/Call Center/PC/Phones Tablet",699,30% Off,controllers-and-joysticks,noon
Log Electronics Wireless Controller For PlayStation 4,590,33% Off,controllers-and-joysticks,noon
havit HAVIT H2002d Gaming Headset - Red Works with PlayStation 4/5 - Nintendo Switch - Xbox - Pc - Mobile Phones 1 - Surround Headset,"1,599",20% Off,controllers-and-joysticks,noon
