title,price,offer,category,site
Forev Transparent Wireless Dual-Mode RGB Bluetooth Mouse Ergonomic Universal Hots Adjustable to 1600dpi / FV-T7 purple,699,N/A,controllers-and-joysticks,noon
REDRAGON K626P ASHE RGB 78% Gaming Mechanical Keyboard Low Profile Blue Switches,"2,626",32% Off,controllers-and-joysticks,noon
Forev FV-185 Wireless 2.4Ghz Office Mouse – Energy Saving Lightweight -10m Range | Black,205,N/A,controllers-and-joysticks,noon
"Gigamax Wireless Gamepad 2.4G (GP-2024), Support PS3/PS4/Xbox 360/Android/PC Windows","1,595",13% Off,controllers-and-joysticks,noon
Sony Playstation UAE 70 USD Gift Card,"4,983",8% Off,controllers-and-joysticks,noon
DOMILINA Protective Vinyl Skin Decal Cover For Microsoft Xbox One S Console Wrap Sticker Skins With Two Free Wireless Controller - Usa Flag,245,N/A,controllers-and-joysticks,noon
Sony Dualshock Wireless Controller For PlayStation 4 - International Version,"3,600",N/A,controllers-and-joysticks,noon
"MARVO Wired mouse MS003, white office Mouse - 1000DPI",149,N/A,controllers-and-joysticks,noon
Dob dob Microphone wired dynamic unidirectional M11-WD,"1,199",N/A,controllers-and-joysticks,noon
T-DAGGER T-DAGGER TGK313 Bora Gaming Mechanical Keyboard - Rainbow LED Lighting - Hot Swappable Switches Red Switch,890,10% Off,controllers-and-joysticks,noon
"REDRAGON GM305. Designed for professionals- High quality audio pickup, delivers accurate, clear and natural sound quality with minimal background noise, ensuring your voice is heard amazingly clarity, making it ideal for live streamers,","2,799",N/A,controllers-and-joysticks,noon
Generic Wireless Mouse,160,N/A,controllers-and-joysticks,noon
ماركة غير محددة باده لوحة ماوس الألعاب AGILITY GD21 DRAGON TIAMAT 320 مم (الطول) × 220 مم (العرض) × 3 مم (الارتفاع),79,19% Off,controllers-and-joysticks,noon
Zero Zero ZR-1800 7D LED Optical Gaming Mouse USB Wired for Laptop and PC - Black,250,N/A,controllers-and-joysticks,noon
"Utopia Wireless Gamepad - 7 in 1 for PS1, PS2, PS3, Laptop, PC, USB, Android TV, Android Media Box - with battery - Red Color",599,N/A,controllers-and-joysticks,noon
"Forev E-Sports gaming mouse with 1.5M USB Cable , silent key ,macro program ming , optical engine , LED Light , 4-level adjustable (1200 - 1800 - 2400 - 3600 DPI ) , Support windows 2000 / XP / win7 / win8 / win10 / vista / 32bit IOS or latest - FV-X9 , black",288,N/A,controllers-and-joysticks,noon
Lenovo Legion M300s RGB Gaming Mouse (Black),"1,999",9% Off,controllers-and-joysticks,noon
"REDRAGON Redragon M988 Storm Lightweight RGB Gaming Mouse, 85g Ultralight Honeycomb Shell - 16,000 DPI Optical Sensor - 8 Programmable Buttons - Precise Registration - Super-Lite Cable","1,599",N/A,controllers-and-joysticks,noon
REDRAGON M601-BA Ergonomic Wired Gaming Mouse And Large Mouse Pad Set Of 2 Pieces For PC Gamer - Black,820,34% Off,controllers-and-joysticks,noon
REDRAGON Redragon M705 7200 DPI Ergonomic Design 6 Programmable Buttons Gaming Mouse,655,27% Off,controllers-and-joysticks,noon
SUP 400-In-1 MIni Handheld Gaming Console,519,N/A,controllers-and-joysticks,noon
"Meetion Meetion USB Single Ear Telephone Headset - HP002U, Black",529,24% Off,controllers-and-joysticks,noon
"Nintendo Joy Cons Wireless Controller for Nintendo Switch, L/R Controllers Replacement Compatible with Nintendo Switch - Neon Yellow/Blue","4,499",N/A,controllers-and-joysticks,noon
REDRAGON K589 Shrapnel Mechanical Keyboard-Red Switch,"2,999",44% Off,controllers-and-joysticks,noon
DOBE Silicone Protection Case PS4-Blue,210,30% Off,controllers-and-joysticks,noon
Zero Zero ZR-4001 Dual Analog Wired Game Controller,315,N/A,controllers-and-joysticks,noon
3M 2-Piece F.C Barcelona Printed Controller Skin Sticker For PlayStation 4,100,N/A,controllers-and-joysticks,noon
FANTECH Trifecta GS301 Mobile Gaming And Music Wired Speakers,"1,240",N/A,controllers-and-joysticks,noon
Vinyl Decal Console And Controller Decal Sticker Set For PlayStation 5 Digital Version,399,N/A,controllers-and-joysticks,noon
REDRAGON Redragon GS530 Air Gaming Speaker - RGB backlight - Power on off/Volume Control - USB + 3.5mm,890,52% Off,controllers-and-joysticks,noon
THTB Skin Protective Cover For PS4 Controller,245,N/A,controllers-and-joysticks,noon
Wenger PlayStation 4 Pro Zamalk Skin,116,N/A,controllers-and-joysticks,noon
Lenovo Legion H300 Over Ear Gaming Headset With Mic,"3,999",11% Off,controllers-and-joysticks,noon
DOBE Dobe Split PS5 DualSense Controller Grip Silicone Cover Case - Dark Green,300,N/A,controllers-and-joysticks,noon
XBOX Wireless Controller,"3,500",N/A,controllers-and-joysticks,noon
Zero Zero Wired Gaming Keyboard - ZR-2090 RGB in Arabic and English. Black,550,N/A,controllers-and-joysticks,noon
Oivo Dual USB Charging Dock Station For PS4/PS4 Pro/PS4 Slim Controller,399,N/A,controllers-and-joysticks,noon
Forev For Forev FV-988 Dual Mode Bluetooth / 2.4G Wireless Mouse Lightweight - 3 Buttons - Power Saving - 1600 DPI - Ergonomic Design For Office Business (1x AA Battery) | (Black),280,N/A,controllers-and-joysticks,noon
"REDRAGON Wired Gaming Mouse M613- RGB Trident Lite , Lightweight 8000 DPI , 7 Programmable Buttons or personalized in-game controls and  programmable light patterns for dynamic visuals - Black",970,N/A,controllers-and-joysticks,noon
DOBE Silicone Protection Case PS4-Red,250,16% Off,controllers-and-joysticks,noon
E-Train E-train (MO10B) Wireless Optical Mouse 1200DPI - Black,269,N/A,controllers-and-joysticks,noon
Decalac Skin Sticker For Sony PlayStation 4 Console  PS4-Abs034,399,N/A,controllers-and-joysticks,noon
"Cougar COUGAR-EGY (9012) USB Wired Double Gamepad Turbo Controller with Vibration Function For PC or Laptop, 1.5 Meter (BLUE)",550,N/A,controllers-and-joysticks,noon
Vinyl Decal Console And Controller Sticker Set For PlayStation 4 Slim Red Dead Redemption,399,N/A,controllers-and-joysticks,noon
FANTECH USB Wired Keyboard & Mouse Set,399,N/A,controllers-and-joysticks,noon
"FANTECH Mechanical Gaming Keyboard,RGB Full size, with 10 lighting effects","1,298",N/A,controllers-and-joysticks,noon
TWINS Dual USB 2.0 Game Controller for Computers and Laptops,349,N/A,controllers-and-joysticks,noon
Oivo Charging Station 2H Fast Charger Playstation 5 Dual Sense Upgrade Charging Dock With 2 Types Of Cable PS5 Charger For Dual PS5 Controller,"1,200",11% Off,controllers-and-joysticks,noon
"BENGOO BENGOO KM-1 Rechargeable Wireless Mouse Gaming , RGB Lighting , Optical 3,200 DPI , Lightweight Honeycomb Shell, 6 Buttons, USB Receiver for PC Mac | Black",425,25% Off,controllers-and-joysticks,noon
Zero Zero USB Gaming Keyboard  ZR-2080 Black,375,N/A,controllers-and-joysticks,noon
Vinyl Decal 3-Piece Batman Logo Printed Gaming Console And Controller Sticker Set For PlayStation 4,245,N/A,controllers-and-joysticks,noon
"Point Gaming Keyboard, Multimedia Shortcuts, Ultra-Thin, English and Arabic Letters - PT-80",399,20% Off,controllers-and-joysticks,noon
DOBE Silicone Protection Case PS4-Black,250,16% Off,controllers-and-joysticks,noon
KOTION EACH G4000 Wired Over-Ear Headphones With Mic,700,N/A,controllers-and-joysticks,noon
كوجار ذراع التحكم كوغار للكمبيوتر 2 قطعة (2082 - أحمر),350,N/A,controllers-and-joysticks,noon
SKIN Christiano Ronaldo Skin Sticker For PlayStation 4,245,N/A,controllers-and-joysticks,noon
"SPARKFOX SPARKFOX W20P508 Dual Charger With Contacts Wireless Handle Charger For PS5, Style: Charger+Data Cable",900,14% Off,controllers-and-joysticks,noon
Yesido C245 Design With 6PCs Magnets With Free Rotating Fulcrum Ball Air Vent Clip Magnetic Phone Holder,399,20% Off,controllers-and-joysticks,noon
"Acer Acer Nitro Gaming Mouse – Customizable weight to maximize your gameplay, 8 buttons and 6 adjustable DPI lighting, Black (NMW810)",599,14% Off,controllers-and-joysticks,noon
JERTECH JERTECH JK520-USB mechanical gaming keyboard-104 keys without conflict-variable LED backlight-comfortable and soft-touch keys-elegant and comfortable design of the highest quality-black,"1,422",N/A,controllers-and-joysticks,noon
"XTRIKE ME GM520 RGB Gaming Mouse - Optical Sensor 12,800 DPI - 8 Programmable Buttons - 1000HZ Polling Rate With Software",649,35% Off,controllers-and-joysticks,noon
DOBE Dual Charging Dock For Xbox One Wireless Game Controller,199,N/A,controllers-and-joysticks,noon
DOBE PS4 Controller Dual Charging Dock,350,22% Off,controllers-and-joysticks,noon
Forev Transparent Wireless Dual-Mode RGB Bluetooth Mouse Ergonomic Universal Hots Adjustable to 1600dpi / FV-T7 white,699,N/A,controllers-and-joysticks,noon
GameSir GameSir G7 HE Xbox Controller - Black,"2,699",10% Off,controllers-and-joysticks,noon
Point Point GAMEPAD DOUBLE NORMAL POINT COLOR PT703,195,35% Off,controllers-and-joysticks,noon
"Generic Desk Mat Large Mouse Mat XL Gaming Mouse Pad  Anti-Slip Desk Protector Keyboard Pad Computer Accessories for Office Home Work, Boho  700*300*3mm",175,20% Off,controllers-and-joysticks,noon
3M PS5 Stickers Full Body Vinyl Skin Decal Cover For PlayStation 5 Digital Edition Console Controllers Digital Edition,194,N/A,controllers-and-joysticks,noon
"Generic Gaming Mouse Pad - Non-Slip Water-Resistant Rubber Base Computer Sea Wave Keyboard Mouse Mat,XL Large Anime Mouse Pad for Desk Computer Office Gaming 700*300*2MM",179,18% Off,controllers-and-joysticks,noon
"Yesido Stereo surround gaming headset with lighting for PlayStation, Xbox and Computer RGB Yesido EK01","1,599",60% Off,controllers-and-joysticks,noon
Ipega Bluetooth Gamepad With Phone Holder For Android/PC/TV Box - Wireless,890,N/A,controllers-and-joysticks,noon
"Generic Mini Hand Mouse Pad 3MM , Cute Design HD Print Pattern Desk Mat, Extended Mouse Pad and Keyboard Mouse Pads, Waterproof Fabric Surface Mouse Pads for Office, Anti-Slip Rubber Base",65,59% Off,controllers-and-joysticks,noon
REDRAGON K589 Shrapnel RGB Low Profile Mechanical Gaming Keyboard,"2,899",46% Off,controllers-and-joysticks,noon
Forev FV-185 Wireless 2.4Ghz Office Mouse – Energy Saving Lightweight -10m Range | Black,275,38% Off,controllers-and-joysticks,noon
"Yesido Surrounding stereo gaming headset with lighting for PlayStation, Xbox, mobile and computer RGB Yesido EK02","1,249",37% Off,controllers-and-joysticks,noon
"JERTECH Jertech DK500 USB Mini Silent Keyboard , Wired Office Comfort keyboard - 78 Slim Round keycap - Arabic & English | Pink",275,21% Off,controllers-and-joysticks,noon
Forev FVQ302 Mixed Color Wired Mechanical Gaming Illuminated Keyboard (white purple),"1,179",N/A,controllers-and-joysticks,noon
Point point combo gaming rgb Mouse and Keyboard with Mouse Pad black,750,16% Off,controllers-and-joysticks,noon
A PLUS AB-53R 5V TO 12V CABLE,75,N/A,controllers-and-joysticks,noon
Yesido EK03 Game Headset With Wire Flexible Headphone 3.5mm Audio Jack And USB HD HIFI Black,"1,249",50% Off,controllers-and-joysticks,noon
"Earldom Earldom ET-B01 Wired Headphone, Black",499,44% Off,controllers-and-joysticks,noon
PXN 2119 Pro - Controller with Vibration Flight Simulator Stick for PS4/XBOX ONE Windows XP/VISTA/7/8/10(NOT Compatible with Mac Systems,"5,999",25% Off,controllers-and-joysticks,noon
GameSir G7 SE Wired Controller For Xbox / PC – White,"2,695",N/A,controllers-and-joysticks,noon
"Generic X3 Streaming Mixer with Audio Interface BT SoundBoard Voice Changer Sound Card, Studio Beginner Podcast Mixer Equipment for PC Phone Live Streaming Podcasting Recording","1,199",40% Off,controllers-and-joysticks,noon
Gamma GAMMATECH M61 Optical Mouse Colors,105,N/A,controllers-and-joysticks,noon
Gamma GT-607 GAMMA GAME PAD TURBO,447,N/A,controllers-and-joysticks,noon
XO XO M3 Wolf Warriors RGB Game Wired Mouse 1.5 Meter-Black,579.05,N/A,controllers-and-joysticks,noon
Sony PlayStation Live Card $50 For UAE Account,"3,074",21% Off,controllers-and-joysticks,noon
Yesido Yesido-Professional Gaming Headset-HD Microphone-RGB Cool Lights-EK02,"1,350",N/A,controllers-and-joysticks,noon
"steelseries Sensei Ten - Gaming Mouse - 18,000 Cpi Truemove Pro Optical Sensor - Ambidextrous Design - 8 Programmable Buttons - Rgb Lighting","3,266",N/A,controllers-and-joysticks,noon
XTRIKE ME Backlit 7.1 Surround Gaming Headset,480,28% Off,controllers-and-joysticks,noon
Point point combo gaming Mouse and Keyboard with Mouse Pad black,725,14% Off,controllers-and-joysticks,noon
"onikuma CW908 Gaming Mouse - 7,200 DPI",266.10,23% Off,controllers-and-joysticks,noon
Point point combo gaming rgb Mouse and Keyboard with Mouse Pad black,900,N/A,controllers-and-joysticks,noon
2B 2B Wireless Single Gamepad Turbo Dual Vibration 3 in one (PC- PS3) - Black Shell GP076,"1,189",N/A,controllers-and-joysticks,noon
Zero Gamepad Trubo Double Joystick Usb,440,N/A,controllers-and-joysticks,noon
EHOME Carrying Bag For Sony PlayStation 4,330,N/A,controllers-and-joysticks,noon
"REDRAGON GM211 Cardioid pointing mode RGB microphone 6 color gradient dazzling light pick up the rhythmic light, projector light Cardioid pointing pickup mode Built in sound card Super CD-level 96kHz sampling rate","2,186",N/A,controllers-and-joysticks,noon
Cool Gear Controller 4 Wireless Controller For PlayStation 4 (PS4),940,22% Off,controllers-and-joysticks,noon
Generic Japanese Blue and Black Sea Wave Mouse Pad Abstract Blue Desk Mat (70cm x 30cm x 2mm ) Sea Wave Texture Non-Slip Rubber Base Wave Mousepad Stitched Edges Keyboard Mouse Mat Desk Pad for Office Home Game,179,29% Off,controllers-and-joysticks,noon
HYPERX Cloud Stinger 2 Core Wired Gaming Headset,"3,100",20% Off,controllers-and-joysticks,noon
HORI Ultra High Speed 2.0M HDMI Cable Nylon Braided With 8K/60fps And 4K/120fps For Playstation 5 - Officially Licensed By Sony,349,N/A,controllers-and-joysticks,noon
Kisonli Kisonli Multimedia Mini LED RGB Speaker - Multicolor,369,7% Off,controllers-and-joysticks,noon
"Forev Wireless Mouse FV-988 , Soft Quiet Buttons Official Business Mouse with High Speed Roller for PC Laptop - Pink",320,36% Off,controllers-and-joysticks,noon
SUP 400-In-1 Portable Retro Console,475,22% Off,controllers-and-joysticks,noon
"FANTECH RGB Gaming Mechanical Keyboard Full Size , Switch","1,679",N/A,controllers-and-joysticks,noon
Yesido YESIDO - GAME HEADSET (EK03),"1,199",60% Off,controllers-and-joysticks,noon
REDRAGON GS514 KAGE RGB Desktop Speaker 2.0 Channel Stereo – USB Powered + 3.5mm Cable,699,15% Off,controllers-and-joysticks,noon
Rapoo Illuminated Gaming Headset RGB Colours,725,9% Off,controllers-and-joysticks,noon
Generic Controller Wireless Controller For Playstation 4 (Ps4),674.95,N/A,controllers-and-joysticks,noon
HYPERX HyperX Cloud II Wired Gaming Earbuds - Red,"2,499",16% Off,controllers-and-joysticks,noon
PowerA PowerA Enhanced Wired Controller for Xbox Series X|S – Metallic ICE,"2,932",N/A,controllers-and-joysticks,noon
Ipega PG-9157 Bluetooth 4.0 Multimedia Joystick Gamepad Controller - wireless,890,N/A,controllers-and-joysticks,noon
REDRAGON M901 Ergonomic USB Gaming Mouse,"1,349",22% Off,controllers-and-joysticks,noon
Zero Gamepad Double Analog Black,371,N/A,controllers-and-joysticks,noon
PXN V3II Racing Game Steering Wheel With Brake Pedal,"5,000",N/A,controllers-and-joysticks,noon
REDRAGON M990 Legend 24000 DPI High-Precision Programmable Laser Gaming Mouse- wired,"1,750",N/A,controllers-and-joysticks,noon
Cougar Cougar egy designed laptop sleeve 15.6 inch Protective Case,250,N/A,controllers-and-joysticks,noon
AVATTO Wireless Gaming Mini Keyboard,398.30,13% Off,controllers-and-joysticks,noon
Lenovo Legion H500 Pro Gaming Headset,"6,090",19% Off,controllers-and-joysticks,noon
"REDRAGON H848 Bluetooth Wireless Gaming Headset - Multi Platforms For PC, PS5/PS4/PS3, Switch & Mobile","2,810",N/A,controllers-and-joysticks,noon
Ipega Bluetooth Gamepad With Phone Holder For Android/PC/TV Box - Wireless,890,N/A,controllers-and-joysticks,noon
havit Gamenote HY505 Gaming Headset StandFor PS4/PS5/XOne/XSeries/NSwitch/PC,375,62% Off,controllers-and-joysticks,noon
JERTECH Slim Ergonomic Gold Rainbow Backlight Wired Gaming Keyboard and Mouse Combo for PC Gamer Laptop KM960,950,N/A,controllers-and-joysticks,noon
"Generic Havit KB851L - USA RGB Mechanical Gaming Keyboard, Black","3,000",N/A,controllers-and-joysticks,noon
Standard ST-Standard GM-08 Stereo Gaming Headset 7.1 Surround Sound,900,23% Off,controllers-and-joysticks,noon
Standard ST-Standard GM-07 Stereo Gaming Headset 7.1 Surround Sound,850,24% Off,controllers-and-joysticks,noon
Generic GINFULL 120GF/1.2N NEW Upgraded V5.2 3D Analog Hall Effect Joystick For PS5 Controller Software Calibration,"1,500",25% Off,controllers-and-joysticks,noon
Generic Handheld Digital Video Game Console with 400 Classic FC Game Consoles 2.8 Inch Color Screen Support 2 Players Birthday Gift for Kids Adults by TOYS-EGYPT (Yellow),424.95,N/A,controllers-and-joysticks,noon
DOBE Silicone Case For PS5 Controller - Blue,199,33% Off,controllers-and-joysticks,noon
Generic Silicone Cover Case for Nintendo Switch,470,N/A,controllers-and-joysticks,noon
DOBE Silicone Case For PS4 Controller,199,33% Off,controllers-and-joysticks,noon
TWINS TWINS Double Shock USB Gaming Controller – Ergonomic Design with Vibration Feedback & Turbo Mode,600,40% Off,controllers-and-joysticks,noon
Standard ST-Standard GM-09 Stereo Gaming Headset 7.1 Surround Sound,950,20% Off,controllers-and-joysticks,noon
Standard ST-Standard GM-2100ENC Stereo Gaming Headset 7.1 Surround Sound With Noise-Cancelling Mic - Blue,775,22% Off,controllers-and-joysticks,noon
"Generic Wired Gaming Headset X9 , 4D virtual speaker system , 5mm surround sound , Noise reduction microphone, Comfortable soft and breathable without ear pressure , 3.5mm USB LED- Black",445,31% Off,controllers-and-joysticks,noon
"Generic Wired Gaming Mechanical Keyboard AK61 RGB , Blue Switch ,  Hot Swap ,  61 English Keys Layout , Compatible with Windows xp / Windows 7/8/10 / Mac Operating System - Black",775,40% Off,controllers-and-joysticks,noon
"DOBE 12 in 1 Game Kit for PS5 1*dual charger base (TP5-0591), 1*stereo headset (TY-1802), 1 set of PS5 handle trigger button, 1 set of PS5 handle rocker cap, 1*PS handle display stand, 1*Type- C wired",699,22% Off,controllers-and-joysticks,noon
"Gigamax Wireless Desk Mouse, G-1400, 1600 DPI Wired/Wireless Functional Mouse with 3 Modes Connectivity, Bluetooth and 2.4G Wireless, 4 Macro Buttons, Long Lasting Rechargeable Battery Capacity and for PC/Mac/Laptop Used in Home and office, Green",275,21% Off,controllers-and-joysticks,noon
"Genius KB-118 Stylish and Durable Full-Size Classic Wired Keyboard, Genius Classic Keyboard Ideal for Most Applications, Durable Keycaps Suitable for Quiet Typing with Smooth Touch and Low-Range Keys, Suitable for Libraries and Offices Excellent for Everyday Use Easy to Use, USB Port Makes Plug and Play Easy - Black",235,47% Off,controllers-and-joysticks,noon
"Generic Mechanical Rainbow Gaming Keyboard , KNUP MADSET KP-TE121 with Wrist rest , Red Switch , 107 Anti-ghosting keys , 7-color backlight for pc - black",850,29% Off,controllers-and-joysticks,noon
Generic 8.5 Inch Portable LCD Writing Tablet - Digital Drawing Board for Kids and Adults - Electronic Whiteboard - Green,80,N/A,controllers-and-joysticks,noon
"Generic Ola SC300 Rechargeable Gaming Mouse, RGB, Up to 3200 DPI, 680mAh Battery, 2.4GHz Wireless Optical, Black",700,N/A,controllers-and-joysticks,noon
Generic 8.5 Inch Portable LCD Writing Tablet - Digital Drawing Board for Kids and Adults - Electronic Whiteboard - Blue,80,N/A,controllers-and-joysticks,noon
Generic Carbon Fiber Finger Sleeves For PUBG Mobile Games Contact Finger Sleeve - Black,29,N/A,controllers-and-joysticks,noon
"Generic AULA SC200 Rechargeable Bluetooth Mouse, LED Wireless Gaming Mouse with Side Buttons, DPI Adjustable Multi-Device(BT5.0+BT3.0+2.4G) Office Games Computer Mice for PC Mac Laptop/Tablet/Cellphone, Black",725,N/A,controllers-and-joysticks,noon
Generic 8.5 Inch Portable LCD Writing Tablet - Digital Drawing Board for Kids and Adults - Electronic Whiteboard - Red,80,N/A,controllers-and-joysticks,noon
"AULA AULA SC200 Rechargeable Bluetooth Mouse – Wireless LED Gaming Mouse, Adjustable DPI, Multi-Device (BT5.0/BT3.0/2.4G), Side Buttons (Black)",750,N/A,controllers-and-joysticks,noon
Generic Anti-sweat finger protectors with ventilation pores for controllers for mobile games such as PUBG and Fortnite - 8 fingers,99,N/A,controllers-and-joysticks,noon
"Generic SC200 Wireless Bluetooth Gaming Mouse with Rechargeable Battery, Programmable Side Buttons, LED Backlight and Ergonomic USB Receiver for PC, Mac, Laptop, Tablet, Smartphones by Ola (Black)",725,N/A,controllers-and-joysticks,noon
Generic Protective Cover For Nintendo Switch,470,N/A,controllers-and-joysticks,noon
steelseries Qck Xxl Mousepad,"1,999",9% Off,controllers-and-joysticks,noon
DOBE Silicone Protective Case Kit for PS5 Controller - Green,260,13% Off,controllers-and-joysticks,noon
فوريف ماوس مكتب لاسلكي FV-386 - 4 أزرار صامتة 2.4 جيجا هرتز نطاق 10 متر - تصميم أسطواني غير قابل للانزلاق 1600 نقطة في البوصة ، أزرق,260,42% Off,controllers-and-joysticks,noon
فوريف ماوس مكتب لاسلكي FV-386 - 4 أزرار صامتة 2.4 جيجا هرتز نطاق 10 متر - تصميم أسطواني غير قابل للانزلاق 1600 نقطة في البوصة | أبيض,260,42% Off,controllers-and-joysticks,noon
nacon Wired Compact Controller For PlayStation 4 Red,"2,810",N/A,controllers-and-joysticks,noon
havit KB870L Suspension Keys Backlit Mechanical Gaming Keyboard,"2,000",N/A,controllers-and-joysticks,noon
"Marvo M292 Gaming Mouse – 7 Programmable Buttons – 7 RGB Colorful Breathing Light – Adjustable 8000DPI – USB Wired Ergonomic Optical Mouse  for PC, Laptop | Black",375,25% Off,controllers-and-joysticks,noon
onikuma ONIKUMA CW917 Professional Gaming Mouse Wired RGB Lighting Adjustable DPI 1200/1800/2400/3600 for PC Laptop-CABLE 1.5 M-BLACK,650,N/A,controllers-and-joysticks,noon
Standard ST-Standard GM-2100LG Stereo Gaming Headset,725,23% Off,controllers-and-joysticks,noon
"DOBE DOBE PS5 Controller Display Stand Station, Non-Slip Controller Desktop Mount Dock Holder for Sony PlayStation 5 Dual Sense Gamepad Controller",750,16% Off,controllers-and-joysticks,noon
DOBE Dual Charging Dock For PlayStation 5 Controller,470,N/A,controllers-and-joysticks,noon
ماركة غير محددة وحدة تحكم لاسلكية Dualshock لجهاز PlayStation 4,599,50% Off,controllers-and-joysticks,noon
TWINS TWINS Double Shock USB Gaming Controller – Ergonomic Design with Vibration Feedback & Turbo Mode,600,33% Off,controllers-and-joysticks,noon
Generic AULA SC200 Gray Wireless Bluetooth Gaming Mouse with Side Buttons LED Backlit Tri-Modes(2.4G+BT5.0+BT3.0) Computer Mice for PC Mac Laptop Desltop Tablet Cellphone,710,N/A,controllers-and-joysticks,noon
"Generic AULA SC300 Gaming Rechargeable Mouse, RGB, Upto 3200 DPI, 680 mAh Battery, Wireless Optical Gaming Mouse (2.4GHz Wireless, Black)",690,N/A,controllers-and-joysticks,noon
"Generic SC200 Wireless Bluetooth Gaming Mouse with Rechargeable Battery, Programmable Side Buttons, LED Backlight and Ergonomic USB Receiver for PC, Mac, Laptop, Tablet, Smartphones by Ola (Black)",725,N/A,controllers-and-joysticks,noon
Generic Aluminum Headset Stand - Lightweight 125g - Sturdy & Durable - Black,350,N/A,controllers-and-joysticks,noon
"Generic Wired Gaming Ergonomic Gaming Optical Mouse DM8800 , RGB Backlight OMRON 7N(10M) Micro Switch , 5000 DPI , fast response and enhanced durability - Black",495,36% Off,controllers-and-joysticks,noon
Generic USB Joystick Set of 2 USB Joysticks - Grey Model: GP8072,650,N/A,controllers-and-joysticks,noon
"AULA AULA SC300 Wireless Gaming Mouse – RGB, Rechargeable, 3200 DPI, 680mAh Battery, 2.4GHz (Black)",700,N/A,controllers-and-joysticks,noon
"AULA AULA SC300 Wireless Gaming Mouse, RGB, 3200 DPI, Rechargeable 680mAh Battery, 2.4GHz Optical Mouse – Black",700,N/A,controllers-and-joysticks,noon
"Generic Ola SC200 Wireless Bluetooth Gaming Mouse Built-in 800mAh Battery Side Buttons LED Backlight 2.4G Optical Rechargeable for Laptop, MacBook, Notebook, Tablet, Mobile (Grey)",700,N/A,controllers-and-joysticks,noon
"Generic Ola SC200 Wireless Bluetooth Gaming Mouse Built-in 800mAh Battery Side Buttons LED Backlight 2.4G Optical Rechargeable for Laptop, MacBook, Notebook, Tablet, Mobile (Grey)",700,N/A,controllers-and-joysticks,noon
"AULA AULA SC200 Wireless Bluetooth Gaming Mouse, LED Backlit, Side Buttons, Tri-Mode (2.4GHz + BT5.0 + BT3.0) – Gray",720,N/A,controllers-and-joysticks,noon
"HP Full Size RGB Backlit Wired Mechanical Gaming Keyboard GK100F , 104 buttons , Gaming buttons rated at up to 50 million-clicks , Color uniform,  Blue Switch , overall lighting , friendly design - black",775,22% Off,controllers-and-joysticks,noon
"Generic Mechanical Rainbow Gaming Keyboard , 87-Key  backlighting True Mechanical ,USB to Type-C Cable , Gaming buttons rated at up to 50 million-clicks - black",975,30% Off,controllers-and-joysticks,noon
"Generic Wired Gaming Mechanical Keyboard AK87 RGB , Blue Switch ,  Hot Swap ,  87 English Keys Layout , Compatible with Windows xp / Windows 7/8/10 / Mac Operating System - Black",895,33% Off,controllers-and-joysticks,noon
فوريف ماوس مكتب بصري لاسلكي 2.4 جيجا هرتز (FV-W388/أزرق) 1600 نقطة في البوصة للكمبيوتر الشخصي والكمبيوتر المحمول مع بطارية AA واحدة طويلة العمر وطاقة ذكية,295,35% Off,controllers-and-joysticks,noon
"GAMDIAS Hermes E1C , 3 in 1 Gaming Combo Mechanical Gaming Keyboard Multi-Color LED , 4 Adjustable Levels , Multimedia Key Combinations , Gaming Mouse 3200 DPI , LED Lighting and Gaming Mouse Pad (240 x 180 x 3mm)",775,35% Off,controllers-and-joysticks,noon
Cable Guys Cable Guy Luffy Cable Guy,"1,999",N/A,controllers-and-joysticks,noon
