title,price,offer,category,site
Sony DualSense Wireless Controller for PlayStation 5 - Purple,"4,400",N/A,controllers-and-joysticks,noon
Cougar Cougar Dualshock Wired Controller For PS4 -PS5 Model - White t29,950,N/A,controllers-and-joysticks,noon
Forev FOREV FV-F6 One-Hand Gaming Keyboard with wrist position and Ergonomic design – Rainbow Backlight – English keycaps layout – 35 Membrane Key- For PC/ Mobile / PS4-5 | Black,420,35% Off,controllers-and-joysticks,noon
HORI HORIPAD Pro Designed For Xbox Series,"3,999",N/A,controllers-and-joysticks,noon
"GX Gaming Headset Over Ear, Black - HS-G560",299,33% Off,controllers-and-joysticks,noon
"REDRAGON GC-F006 RGB PC Cooling Fan CPU Cooler and Radiators, Pack of 3,120mm","1,275",36% Off,controllers-and-joysticks,noon
"Logitech F710 Wireless Gamepad, 2.4 GHz Wireless with USB Nano-Receiver, Controller Dual Vibration Feedback, 4 Switch D-Pad, PC - Silver/Black","1,871",N/A,controllers-and-joysticks,noon
XTRIKE ME XMC01 MICROPHONE 3.5MM JACK,350,6% Off,controllers-and-joysticks,noon
Etrain E-train Single USB GamePad with Dual Analog Vibration GP002,255,28% Off,controllers-and-joysticks,noon
"Generic Wired Keyboard (RGB) with cable , type-c port , mechanical switch key ,  storage 32KB , 3 mood switch ( blue - black - red )",725,23% Off,controllers-and-joysticks,noon
"REDRAGON H510 Zeus Wired Gaming Headset - 7.1 Surround Sound - Memory Foam Ear Pads - 53MM Drivers - Detachable Microphone - Multi Platforms Headphone - Works with PC, PS4/3 & Xbox One/Series X, NS","2,177",10% Off,controllers-and-joysticks,noon
Logitech G335 PC Gaming Headset 52915 Black,"2,599",18% Off,controllers-and-joysticks,noon
"REDRAGON FIZZ K617 60% Mechanical Keyboard, Red Key Switches, Hot-Swappable, Detachable Type-C Cable, Pro Software Customizable RGB, Full Rollover 61-Keys, White/Gray | K617-RGB","1,595",29% Off,controllers-and-joysticks,noon
Sony Sony Vertical Stand for PlayStation 5,"3,200",N/A,controllers-and-joysticks,noon
VINSOC Gaming RGB keyboard Mouse Pad,249,N/A,controllers-and-joysticks,noon
"REDRAGON K539 Anubis Wireless 2.4Ghz, Bluetooth and Wired Type C RGB Mechanical Gaming Keyboard - Brown Switch - Super Slim - English & Arabic Black","2,585",51% Off,controllers-and-joysticks,noon
"REDRAGON P032 Flick XL Gaming Mousepad, Dimension 400x900x4mm, Waterproof, Anti Slippery, Cloth and Rubber, Black",640,17% Off,controllers-and-joysticks,noon
Point Point double VIP Gamepad PT-706,325,18% Off,controllers-and-joysticks,noon
T-DAGGER T-DAGGER TGK313 BORA Rainbow TKL Gaming Mechanical Keyboard | Blue Switch,924,N/A,controllers-and-joysticks,noon
PS4 Controller 4 Wireless Controller,940,N/A,controllers-and-joysticks,noon
DOBE Wired Charger Dock For PS4 Controllers,185,47% Off,controllers-and-joysticks,noon
Point GAMEPAD DOUBLE Vibration POINT COLOR PT708,275,21% Off,controllers-and-joysticks,noon
"2B Gp026 5In1 Racing Wheel, For Ps3/Ps4/Pc/Xbox One","3,999",N/A,controllers-and-joysticks,noon
Zero Usb 2.0 Double Gamepad For Pc Or Laptop With Vibration Function,330,N/A,controllers-and-joysticks,noon
"Utopia Wireless Mouse & Keyboard U-200 , 10m Receiving Distance - Black",750,N/A,controllers-and-joysticks,noon
DOBE Silicone Protective Kit For PS5 Controller-Black,260,13% Off,controllers-and-joysticks,noon
Logitech Logitech G435 LIGHTSPEED & Bluetooth Wireless Gaming Headset - Blue,"3,799",32% Off,controllers-and-joysticks,noon
REDRAGON K552 Kumara Mechanical Gaming Keyboard – Rainbow  Backlight – Switch – 87 Key TKL Design – (AR / EN Key ) | Black,"1,385",18% Off,controllers-and-joysticks,noon
T-DAGGER COLONEL Wired Gaming Mouse T-TGM208,440,32% Off,controllers-and-joysticks,noon
Point GAMEPAD DOUBLE NORMAL POINT BLACK PT701,180,25% Off,controllers-and-joysticks,noon
Generic BLUE World Map Gaming Mouse Pad – 70 X 30 cm – Anti Slip Base – Speed Edition,125,34% Off,controllers-and-joysticks,noon
onikuma K1b Over-Ear Gaming Headset With Mic - PS4/PS5 Camou Red,700,N/A,controllers-and-joysticks,noon
"REDRAGON H520 Icon Wired Gaming Headset, 7.1 Surround Sound - Memory Foam Earpads - 50MM Drivers High_End Headphone- Detachable Microphone with Pro Driver - Works with PC, PS4/3 & Xbox One","4,100",9% Off,controllers-and-joysticks,noon
Logitech G613 Wireless Gaming Keyboard,"5,849",15% Off,controllers-and-joysticks,noon
"Generic Mechanical Wired Gaming Keyboard, White , Rainbow LED , with USB Cable and type C Port ,  blue switch, for computer and lap top. It can be used at home, office, and personal use",695,44% Off,controllers-and-joysticks,noon
"HP H220GS Gaming Headset , USB Virtual 7.1 surround sound Over-Ear Headphone , Blue LED Backlit  with Microphone For PC and Laptop | Black",575,11% Off,controllers-and-joysticks,noon
REDRAGON Pelias Wired Gaming Headset Black - H130,755,N/A,controllers-and-joysticks,noon
nacon Nintendo Switch Game Traveler Deluxe System Carrying Case,999,N/A,controllers-and-joysticks,noon
DOBE Silicone Case For PS5 Controller,208,N/A,controllers-and-joysticks,noon
Sony PlayStation 5 - DualSense Wireless Controller - White (UAE Version),"4,405",30% Off,controllers-and-joysticks,noon
havit Gaming series-Gaming headphone,"1,899",N/A,controllers-and-joysticks,noon
JOYROOM Joyroom S-1030N1 USB-A to Type-C Fast Charging Cable 1m - Red,270,N/A,controllers-and-joysticks,noon
Microsoft Play And Charge Kit For Xbox 360,225,N/A,controllers-and-joysticks,noon
Generic Sweat-Resistant Pubg Fingers Suitable For Long Play,19,62% Off,controllers-and-joysticks,noon
Sony DualSense Wireless Controller for PlayStation 5 (God Of War Edition Blue),"7,997",N/A,controllers-and-joysticks,noon
Sony DualSense Wireless PS5 Controller (Official Version) - Cobalt Blue,"4,444",32% Off,controllers-and-joysticks,noon
"REDRAGON Reaping Elite Lightweight Wired Gaming Mouse, RGB Backlit,",999,66% Off,controllers-and-joysticks,noon
Forev Transparent Wireless Dual-Mode RGB Bluetooth Mouse Ergonomic Universal Hots Adjustable to 1600dpi / FV-T7 yellow,699,N/A,controllers-and-joysticks,noon
"REDRAGON K618 Horus Wireless RGB Mechanical Keyboard, BT/2.4Ghz/Wired Tri-Mode Ultra-Thin Low Profile w/No-Lag Cordless Connection, Dedicated Media Control & Linear Red Switch, Black | K618-RGB","3,999",33% Off,controllers-and-joysticks,noon
Forev FV-185 Wireless 2.4Ghz Office Mouse – Energy Saving Lightweight -10m Range | Red,205,N/A,controllers-and-joysticks,noon
REDRAGON Redragon AXE PRO M814RGB  gaming mouse,"1,299",27% Off,controllers-and-joysticks,noon
"Zero ZR-3606 Foldable Bluetooth Wireless Mini Keyboard English & Arabic - Compatible With: PC, Laptops",640,24% Off,controllers-and-joysticks,noon
Generic Carbon Fiber Finger Sleeves For PUBG Mobile Games Contact Finger Sleeve - Black,23,48% Off,controllers-and-joysticks,noon
JBL Quantum 300 Hybrid Wired Over-Ear Gaming Headset With Flip-Up Mic,"3,499",22% Off,controllers-and-joysticks,noon
Zero Zero ZR-5001 GamePad Trubo Joystick USB 1.5 meter cable - Red,280,N/A,controllers-and-joysticks,noon
Cougar COUGAR PS4 Dualshock Wired Controller For PS4 -PS5 model -red t29,950,N/A,controllers-and-joysticks,noon
SUP 400-In-1 Portable Retro Console,550,10% Off,controllers-and-joysticks,noon
Sony DualSense Wireless PS5 Controller (Official Version) - Starlight Blue,"4,444",N/A,controllers-and-joysticks,noon
Sony Playstation UAE 10 USD Gift Card,715,N/A,controllers-and-joysticks,noon
FANTECH Large Gaming Mouse Pad 70cm x 30cm x 2 mm,115,N/A,controllers-and-joysticks,noon
ZIDLI M80 RGB Gaming Mouse - 8800 DPI - Superlight 69G (Black),325,18% Off,controllers-and-joysticks,noon
T-DAGGER TGK313 BORA Gaming Mechanical Keyboard - Rainbow LED Lighting -TKL Size 87 Key - AR / EN Key || Blue Switch,999,28% Off,controllers-and-joysticks,noon
SUP 400-In-1 Portable Retro Handheld Gaming Console,550,N/A,controllers-and-joysticks,noon
Generic Gaming Mouse Pad Size - phangkey amaterasu - 70X30 CM - Stitched Edges Anti-slip rubber base - Optimized for all mouse sensitivities and sensors - speedy mouse movements (70X30 CM),145,47% Off,controllers-and-joysticks,noon
"COOLER MASTER Master Liquid 360L Core White 360mm Close-Loop AIO Liquid Cooler, ARGB Sync, Gen S Coldplate Pump, 120mm PWM, CryoFuze 14W/Mk, AMD Ryzen AM5/AM4, Intel LGA1700/1200 (MLW-D36M-A18PZ-RW)","3,999",27% Off,controllers-and-joysticks,noon
Kayan Wireless Limited Edition Dualshock Controller,840,N/A,controllers-and-joysticks,noon
FANTECH FANTECH HG13 CHIEF Gaming Headset With 2 Jacks for computer & USB for LED LIGHT,559,N/A,controllers-and-joysticks,noon
"AULA Aula F2009 Full Mechanical Gaming Keyboard with Rainbow Backlit LED - Switches, Arabic/English Si-2009","1,000",N/A,controllers-and-joysticks,noon
"HUAWEI HUAWEI Bluetooth Mouse (2nd gen), Bluetooth 5.0/LE, Win 10/8.1, macOS 10.10, iOS 13.1, HarmonyOS 2.0 or later, Android 5.0 or later, Linux, AA Battery, 1200/4200 DPI, Olive Green","1,999",N/A,controllers-and-joysticks,noon
"New Bee H368 USB Headset with Microphone for PC, Computer Headset with Mic, Wired Headset with USB-A & USB-C, Mute, in-Line Controls Call Center Headset for Work PC Laptop Office Phone Meeting Zoom Skype",899,25% Off,controllers-and-joysticks,noon
XBOX Wireless Controller For Xbox 360,"1,340",N/A,controllers-and-joysticks,noon
FIFINE T669 Studio Condenser USB Microphone Computer PC Microphone Kit with Adjustable Boom Arm Stand Shock Mount for Instruments Voice Overs Recording Podcasting YouTube Vocal Gaming Streaming,"2,999",33% Off,controllers-and-joysticks,noon
HP DHE-8005T RGB USB Gaming Headset - 7.1 Surround Sound - 40MM Drivers - RGB Backlit Housing - Hi-Res Mic,450,43% Off,controllers-and-joysticks,noon
"RAZER Kaira X Wired Gaming Headset for Playstation 5 / PS5, PS4, PC, Mac, Mobile: 50mm Drivers - HyperClear Cardioid Mic - Memory Foam Cushions - On-Headset Controls - White & Black","2,899",21% Off,controllers-and-joysticks,noon
ROBLOX Roblox Digital Card $50 only for US account delivery via sms or whatsapp,"3,250",N/A,controllers-and-joysticks,noon
GAME GameSir G7 HE Xbox Controller - Black,"3,267",N/A,controllers-and-joysticks,noon
SKIN Green Hex Normal Skin For PlayStation 4 Slim,245,N/A,controllers-and-joysticks,noon
بوينت جيم باد دابل نورمال بوينت PT706,270,22% Off,controllers-and-joysticks,noon
"HP Gaming headset H100, USB 2.0 cable 50mm speaker wired headphones Over with lighting and lightweight design -Ear Headphones with Mic",575,17% Off,controllers-and-joysticks,noon
"Krom KYUS USB Gaming Headset - 7.1 Surround Sound, Software included, 50MM Drivers, inline Sound control",650,18% Off,controllers-and-joysticks,noon
Meetion Wireless Vertical Mouse - R380,769,23% Off,controllers-and-joysticks,noon
Generic Borealis Gaming Rainbow Backlit 7 Color Mixing Light Effect 104 Keys Arabic And English Keyboard (Black),274,39% Off,controllers-and-joysticks,noon
"Gigamax G-1600 Wireless Office Mouse, 1600 DPI Functional Mouse with 3 Connection Modes, Bluetooth and 2.4G Wireless, 4 Macro Buttons, Long Lasting Rechargeable Battery Capacity for PC/Mac/Laptop, Black",275,31% Off,controllers-and-joysticks,noon
Logitech G413 TKL SE Black Tactile Switch Gaming Keyboard,"4,349",27% Off,controllers-and-joysticks,noon
onikuma K10 Pro Wired Stereo Gaming Headset With Microphone,990,N/A,controllers-and-joysticks,noon
REDRAGON COBRA Wired Gaming Mouse M711C -White/Red,875,27% Off,controllers-and-joysticks,noon
T-DAGGER BORA RED SW Mechanical Gaming Keyboard T-TGK313-2,899,18% Off,controllers-and-joysticks,noon
Rapoo H100 Wired Stereo Over-Ear Headset,500,9% Off,controllers-and-joysticks,noon
Sony Playstation UAE 40 USD Gift Card,"2,852",N/A,controllers-and-joysticks,noon
REDRAGON Redragon M913 Impact Elite Wireless Gaming Mouse,"1,999",9% Off,controllers-and-joysticks,noon
"Monster Airmars N5 Lite Gaming Headset USB 7.1 Surround Sound. Audio Interface with Noise Canceling Mic , Skin-friendly, Breathable Earcups For Lasting Comfort - Black",590,30% Off,controllers-and-joysticks,noon
VR Box 3D Adjust Glasses VR Headset Black/White,229,N/A,controllers-and-joysticks,noon
Logitech H151 Wired Stereo Headset,"1,150",17% Off,controllers-and-joysticks,noon
havit H2016D Wired Gaming Headset For Computer With Led & Noise Cancelling Mic,"1,130",31% Off,controllers-and-joysticks,noon
"REDRAGON Redragon K621 Horus TKL Wireless RGB Mechanical Keyboard, 5.0 BT/2.4 Ghz/Wired Three Modes 80% Ultra Thin Low Profile Bluetooth Keyboard w/Dedicated Media Control & Linear Red Switches, Black","3,005",45% Off,controllers-and-joysticks,noon
GAMDIAS HERMES P1 RGB Mechanical Full Gaming Keyboard – Brown Switches - Micro Processor – 2 Macro Keys - Software,"1,050",25% Off,controllers-and-joysticks,noon
"havit Gaming Headset , Model H2002E Black , Over Ear Wired ( 7.1 USB - 3.5 Port) , cable High Magnetic 50mm Speaker With 3.5mm Plug Version Microphone for PC, Laptop, PS4, Xbox, Switch","1,750",22% Off,controllers-and-joysticks,noon
MARVO MARVO MIC-03 Wired Condenser USB Gaming Microphone,"1,190",29% Off,controllers-and-joysticks,noon
XTRIKE ME GH416 USB RGB Gaming Headset - 7.1 Surround Sound,549,31% Off,controllers-and-joysticks,noon
"Zero ZR-3666 Bluetooth Wireless Keyboard English & Arabic with Slim Frame Design - works on Windows, Android, iOS",675,15% Off,controllers-and-joysticks,noon
MARVO Gaming Headset With Stereo Sound & Flexible Omnidirectional Microphone,288,N/A,controllers-and-joysticks,noon
GAMDIAS POSEIDON M3 5-IN-1 Gaming COMBO ( Gaming Keyboard Multi-Color Backlit Multimedia + RGB Gaming Mouse 3600 DPI + Gaming Headset Lighted 50mm + Non-Slip Gaming Mouse Mat + Minimalist Headset Stand ),949,29% Off,controllers-and-joysticks,noon
Forev FOREV FV-65S Keyboard Mini Silent Office Comfort keyboard USB Wired – 83 Slim chocolate keycap – Arabic / English | Black,285,36% Off,controllers-and-joysticks,noon
"REDRAGON HYLAS H260 RGB Wired Gaming Headset for PC, PS5/PS4, Xbox One - Black","1,099",27% Off,controllers-and-joysticks,noon
"REDMAGIC REDMAGIC Mobile Gaming Controller for Android, Shadow Blade Gamepad Customizable Triggers Ergonomic Design Universal Fit - Stream PC, Xbox, Playstation, Touch Screen Android Games Model:PA3120","3,316",N/A,controllers-and-joysticks,noon
HP GK100F Gaming Mechanical Keyboard  - Blue Switch - Rainbow Backlight 9 Lighting Mode - Full Size 104 Keys -  English Keys | Black,850,22% Off,controllers-and-joysticks,noon
AULA Rainbow Full Gaming Mechanical Keyboard Black,840,6% Off,controllers-and-joysticks,noon
Altec Lansing ALGH9604 Gaming Headset - Mesh Earcups - Noise Cancelling Microphone - Inline Volume Control - Breaded Cable,499,37% Off,controllers-and-joysticks,noon
XTRIKE ME XTRIKE ME GK985P PUDDING 60% Mechanical Keyboard - Rainbow Back-Light - Blue Switches - ENG Key | Black,895,14% Off,controllers-and-joysticks,noon
VR Box Virtaul Reality Glasses Black/White,229,N/A,controllers-and-joysticks,noon
Zero Gamepad Double Analog,300,25% Off,controllers-and-joysticks,noon
"Meetion Meetion keyboard RGB Magnetic Wrist Rest Keyboard for Gaming K9520, Black",849,15% Off,controllers-and-joysticks,noon
"Gigamax Multimedia Keyboard For Computer (GM-5000, Black) - Usb Cable",290,35% Off,controllers-and-joysticks,noon
Gigamax Gamepad Set of 2 USB Joystick - Gray Model : GP8072,675,N/A,controllers-and-joysticks,noon
Meetion 2.4G&Bluetooth Dual Mode - BTM002,659,17% Off,controllers-and-joysticks,noon
REDRAGON GS700 TOCCATA RGB 2.1 Gaming Speaker Subwoofer - Total Power 11W - Materials Plastic + Wooden - USB Powered+3.5mm Cable,"1,530",36% Off,controllers-and-joysticks,noon
"DOBE Multi-functional Cooling, Charging DOCK, White","1,400",15% Off,controllers-and-joysticks,noon
onikuma K16 Professional Wired Gaming Headset With Mic For PS4/PS5/XOne/XSeries/NSwitch/PC black,550,18% Off,controllers-and-joysticks,noon
"GAMDIAS Zeus E2 RGB Gaming Mouse 3,200 DPI + NYX E1 Gaming Mouse Pad 23.5 X 18 CM",275,44% Off,controllers-and-joysticks,noon
MSI GM50 Clutch Wired Gaming Mouse,"2,399",11% Off,controllers-and-joysticks,noon
"Forev Gaming Keyboard – 98% Compact USB / USB Type-C Wired Mechanical Keyboard – RGB Backlighted – 98 ENG Keys PBT Keycaps – Blue Switches – For Mac / Win | Blue ,White","1,680",N/A,controllers-and-joysticks,noon
Cougar COUGAR PS4  Wired Controller For PS4 -PS5 model - blue T29,950,N/A,controllers-and-joysticks,noon
REDRAGON Redragon A106 Steampunk Typewriter Retro Keycaps Set For Mechanical Gaming Keyboard 104 Keys Us Layout Keycaps Vintage Style,269,N/A,controllers-and-joysticks,noon
T-DAGGER TGK313 BORA Gaming Mechanical Keyboard with LED Lighting Rainbow - Blue Switch,999,31% Off,controllers-and-joysticks,noon
"ASUS Asus ROG Strix Impact III Wireless Gaming Mouse, 57 G Lightweight, 36K DPI Sensor, Bluetooth & 2,4GHz RF, ROG SpeedNova, Up to 618hrs Battery Life, Replaceable Switches, ROG Omni Receiver, Black","3,824",N/A,controllers-and-joysticks,noon
GAME GameSir T7 Xbox Wired Controller - White,"2,500",N/A,controllers-and-joysticks,noon
FANTECH X16 Thor Ii Macro Programmable Running RGB Chroma Gaming Mouse with USB Interface for Computer,850,N/A,controllers-and-joysticks,noon
REDRAGON H510 Zeus-X RGB White Wired Gaming Headset - 7.1 Surround Sound - 53MM Audio Drivers in Memory Foam Ear Pads w/Durable Fabric Cover- Multi Platforms Headphone - USB Powered for PC/PS4/NS,"2,850",18% Off,controllers-and-joysticks,noon
Crown Controller 4 Wireless Controller For PlayStation 4 - Blue Camouflage,940,N/A,controllers-and-joysticks,noon
onikuma ONIKUMA X26 Professional Wired Gaming Headphones HD Mic Stereo Surround Sound RGB,800,N/A,controllers-and-joysticks,noon
Sony Playstation UAE 100 USD Gift Card,"7,015",10% Off,controllers-and-joysticks,noon
"REDRAGON 4 in 1 Combo S101-BA-2 Keyboard, Mouse, Headset & Mouse Pad","2,225",N/A,controllers-and-joysticks,noon
"REDRAGON Redragon K617 Fizz 60% Compact RGB Wired Mechanical Keyboard, 61 Keys TKL - White/ Pink- Red Switch","1,899",36% Off,controllers-and-joysticks,noon
onikuma ONIKUMA K8 Wired Gaming Headphone - Black,750,N/A,controllers-and-joysticks,noon
"Logitech G335 Wired Gaming Headset With Flip to Mute Microphone, 3.5mm Audio Jack, Memory Foam Earpads, Lightweight, Compatible with PC, PlayStation, Xbox","2,800",29% Off,controllers-and-joysticks,noon
Forev FV-Q301 Rainbow TKL Mechanical Gaming Keyboard – Blue Switch – 87 keys – Black,"1,250",16% Off,controllers-and-joysticks,noon
XTRIKE ME GK985P 60% Pudding Gaming Mechanical Keyboard - Blue Switches - Rainbow LED Lighting,890,28% Off,controllers-and-joysticks,noon
Sony Playstation US 30 USD Gift Card,"1,950",N/A,controllers-and-joysticks,noon
"Forev Gaming Mouse FV-210, Bluetooth Mouse 2 types of connection 2.4G radio channel and Bluetooth, a sensitive sensor with 3 DPI modes and switchable RGB backlight - black",475,36% Off,controllers-and-joysticks,noon
"T-DAGGER T-DAGGER TGM208 COLONEL RGB Gaming Mouse | 6,400 DPI Optical Sensor | 6 Programmable Buttons",490,29% Off,controllers-and-joysticks,noon
"REDRAGON H848B IRE Pro Headphones, Tri-Mode Connection, 40mm Driver Size, 7.1 Virtual Surround, Detachable Microphone, 2.4G/BT/Wired Connectivity, White/Blue | H848B","2,599",33% Off,controllers-and-joysticks,noon
LAVVENTO L'AVVENTO 2.4GHz Wireless Mouse - White*Gold MO34W,460,34% Off,controllers-and-joysticks,noon
"Meetion USB Wired Telephone Headset, HP003U",549,21% Off,controllers-and-joysticks,noon
Generic Large Gaming Mouse Pad for Animate Gamer RGB LED Glowing Gaming Mouse Keyboard Pad Mat (Onepiece),200,63% Off,controllers-and-joysticks,noon
Zero Gamepad Trubo Double Joystick Usb -ZR-6001,440,N/A,controllers-and-joysticks,noon
REDRAGON Redragon K624P Elise Pro Rgb 60% Wireless 2.4Ghz / Bluetooth 5.0 / Wired Type C Gaming Mechanical Keyboard – Low Profile Blue Switches (Black),"2,645",52% Off,controllers-and-joysticks,noon
onikuma G55 60% Mechanical Gaming Keyboard - BROWN Switches - RGB Rainbow Backlighted - Detachable USB Wired – 61 Keys EN  - Double injection key caps Illumination | Black,750,24% Off,controllers-and-joysticks,noon
REDRAGON Redragon M801 Mammoth 12400 DPI Programmable Laser Gaming Mouse for PC - Black,"1,450",23% Off,controllers-and-joysticks,noon
Generic Soft Skin Mouse Pad With Gel Wrist Support Band - Pink,80,46% Off,controllers-and-joysticks,noon
REDRAGON K577R KALI Gaming Mechanical Keyboard – Red Switches (Black),"2,025",30% Off,controllers-and-joysticks,noon
Earldom Earldom BH65-Wireless headset- doal noise reduction function block of noise on call,899,N/A,controllers-and-joysticks,noon
"RAZER Razer BlackShark V2 X Gaming Headset: 7.1 Surround Sound, 50mm Drivers, Memory Foam Cushion, for PC, PS4, PS5, Switch, Xbox One, Xbox Series X|S, Mobile, 3.5mm Audio Jack, Classic Black","3,999",N/A,controllers-and-joysticks,noon
FANTECH VX7 Crypto Gaming Wired Mouse White,549,21% Off,controllers-and-joysticks,noon
"Maono AU-MH601 Over Ear Stereo Monitor Closed Back Headphones 50MM Drivers Studio Headphones for Music, DJ, Podcast (Black)","2,299",23% Off,controllers-and-joysticks,noon
REDRAGON K617 Fizz RGB 60% Gaming Mechanical Keyboard – Brown Switches,"1,990",20% Off,controllers-and-joysticks,noon
"Point Gaming Keyboard, multimedia shortcuts, WaterProof, Wired USB interface, English and Arabic - Point PT-75",279,30% Off,controllers-and-joysticks,noon
"REDRAGON K684 Wireless Mechanical Keyboard with Number Pad, Triple Mode Low Profile Keyboard with Bluetooth 5.0, 2.4G and Wired Connection","3,199",N/A,controllers-and-joysticks,noon
Marvo Marvo HZ-10 RGB Headset Stand With 3 Port USB 2.0 Hub And Audio port - RGB lighting with a lighting control button with 1.0 m Cable length | Black,750,16% Off,controllers-and-joysticks,noon
Sony Playstation US 25 USD Gift Card,"1,630",16% Off,controllers-and-joysticks,noon
"Gigamax Wireless Desk office Mouse, G-1200, 1600 DPI Wired/Wireless Functional Mouse with 3 Modes Connectivity, Bluetooth and 2.4G Wireless, 4 Macro Buttons, Long Lasting Rechargeable Battery Capacity and for PC/Mac/Laptop , White",275,43% Off,controllers-and-joysticks,noon
Sony DualSense Wireless PS5 Controller (Official Version) - Purple,"4,249",N/A,controllers-and-joysticks,noon
Sony Playstation KSA 20 USD Gift Card,"1,408",N/A,controllers-and-joysticks,noon
REDRAGON P005A KUNLUN Gaming Mouse Pad – Extended 700 x 350 x 3mm,599,N/A,controllers-and-joysticks,noon
REDRAGON Computer Speaker RGB Orchestra GS811 2.0 Bluetooth,"3,499",22% Off,controllers-and-joysticks,noon
"RAZER Kraken X Ultralight Gaming Headset: 7.1 Surround Sound Capable, Lightweight Frame, Bendable Cardioid Microphone, for PC, Xbox, PS4 And Nintendo Switch","2,389",N/A,controllers-and-joysticks,noon
Nintendo Nintendo Neon Purple/ Neon Orange Joy Con (L-R) - Nintendo Switch,"2,998",N/A,controllers-and-joysticks,noon
Gigamax gamepad vibration,329,37% Off,controllers-and-joysticks,noon
"JBL Quantum 50 Wired, In-Ear Gaming Headphones with Inline Control","1,099",45% Off,controllers-and-joysticks,noon
Techno Zone Techno Zone K-60 Gaming Headphone usb 7.1,"1,099",N/A,controllers-and-joysticks,noon
"HP Optical Mouse Gaming 4 Button , 7 coLor Led 1600DPi - BLack G270",250,N/A,controllers-and-joysticks,noon
"Generic Large Gaming Mouse Map Pad 800×300×3MM ,with Non-Slip Base,Waterproof and Foldable Pad,Desktop Pad Suitable for Gamers,Suitable for Desktop,Office and Home",360,N/A,controllers-and-joysticks,noon
Generic Wireless Game Controller For PlayStation 3,349.65,N/A,controllers-and-joysticks,noon
XTRIKE ME HT-08 Headset Stand with Mobile  holder- Anti-slip Aggravating Base Multi-functional Headset Hanger Earphone Rack – Easy installing,175,30% Off,controllers-and-joysticks,noon
ROBLOX Roblox Digital Card $100 only for US account delivery via sms or whatsapp,"5,654",N/A,controllers-and-joysticks,noon
"REDRAGON K552 Tenkeyless Wired Mechanical Gaming Keyboard and Mouse Combo, RGB LED Backlit, With Arrow Key, 7200 DPI Mouse, For Windows PC Gamers, English Layout, Black | K552-RGB-BA","2,150",N/A,controllers-and-joysticks,noon
Forev FV-Q8 Wired Gaming Keyboard Esports Light-Emitting Office Desktop Laptop Wired Film Wired Keyboard (FV-Q1 Black-Gray),800,N/A,controllers-and-joysticks,noon
"REDRAGON THESEUS H250 Backlight Gaming Headset, 2 JACKS 3.5mm USB FOR LED LIGHT",900,31% Off,controllers-and-joysticks,noon
Techno Zone K-63 Gaming Headphone | New,"1,350",N/A,controllers-and-joysticks,noon
"Gigamax Multimedia Keyboard For Computer (GM-8000, Black) - Usb Socket",425,27% Off,controllers-and-joysticks,noon
"Utopia K-102 Gaming Keyboard with Rainbow LED Lighting, Metal Cover and Plastic Gaming Surface - Easy to use and comfortable.",394,60% Off,controllers-and-joysticks,noon
SEEKYOU 3-Piece Joker Console And Controller Sticker Set For PlayStation 4,245,N/A,controllers-and-joysticks,noon
JBL Quantum 200 Wired Over-Ear Gaming Headset,"2,499",28% Off,controllers-and-joysticks,noon
RAZER BlackShark V2 X - Green Multi-platform Wired Esports Headset - Green,"3,565",20% Off,controllers-and-joysticks,noon
"aigo Q38 USB wired gaming mouse - black, 7 buttons to increase the enjoyment of playing or working, compatible with computers and laptops, personal and office use, comfortable and elegant design",175,30% Off,controllers-and-joysticks,noon
"REDRAGON K617 SE 60% Wired RGB Gaming Keyboard, 61 Keys Compact Full-Transparent Mechanical Keyboard w/Translucent Board, Custom Linear Switch, Pro Driver/Software Supported","2,099",22% Off,controllers-and-joysticks,noon
"REDRAGON K616 Fizz Pro RGB 60% Gaming Wireless & Bluetooth Mechanical Keyboard - Red Switches - 3 Connection Modes (Wired, Wireless 2.4Ghz and Bluetooth) (White Grey)","2,499",30% Off,controllers-and-joysticks,noon
Sony PlayStation 5 DualSense Wireless Controller -Grey Camouflage (International Version),"4,444",N/A,controllers-and-joysticks,noon
REDRAGON P018 Waterproof Gaming Mouse Pad 930x300x3mm Large Extended XXXL Thick Version Stitched Edges,475,19% Off,controllers-and-joysticks,noon
Nintendo 1-Pair Joy-Con,"4,495",N/A,controllers-and-joysticks,noon
